ID,Channel,Content Length,Content
558990798260273172,general,31,i can give context if necessary
558990873736773652,general,20,something did change
558991070218813450,general,205,met her through a reddit meetup for my college freshman year_ was kinda acquaintances and hung out a couple times with her then asked her out last year on a whim even though I knew it wasn't gonna be a yes
558991714233352212,general,10,they might
558991806730338334,general,94,which is why once i head back to my home uni in the fall (about 6 months) I'll test the waters
558991816406335498,general,16,throw some hints
558991830289612820,general,23,see if she reciprocates
558992184699912222,general,80,it's risky but you never get anything worth having without taking risks ya know?
