ID,Content Length,Content
560641622564536325,33,<@304435131509374976> mercury lmg
560642016501825537,78,What dont you have from cb? Could take awhile not knowing what you already got
560642209603387403,36,That doesnt show whats in his cb tho
560642604828590082,100,I could tell him to reseaech a gun that doesnt show up on ss1 but he might already have it in his cb
560642808256659466,106,Itd be a lot easier to start with him telling us what "good" weapons he doesnt have that can be researched
560642992197599242,55,Why not use it on a hero btw? You dead set on a weapon?
560643070975016961,61,No dude youre the one not understanding <@257038066177277952>
560643268774330394,181,I could look through his ss1 schems and he could still have the schem in his fucking CB so i cant tell for sure what he does or doesnt have because ss1 only shows your non-cb schems
