ID,Server,Channel,Content Length,Content
558805502180458508,Official Fortnite,stw-images,14,now thats EPIC
558806356036026389,Official Fortnite,stw-images,6,thx xD
559098531898589204,Official Fortnite,stw-images,54,honestly_ why am i even trying with these afkers .....
559109559734763530,Official Fortnite,stw-images,28,Why all of these though.....
559110548671954984,Official Fortnite,stw-images,43,This guy has got way too many gas traps 😂 😂
559111694463402005,Official Fortnite,stw-images,42,thats EXTRA lol_ duped traps .... great...
560976805461491734,Official Fortnite,stw-images,45,how is it sold out??? didn't buy anything lol
