ID,Content Length,Content
561001084483665920,144,What should I do if my grandma finds out which email I use for Discord_ but not the password?NLCause she's trying to barge into my personal life.
561001371600683048,31,To use to log into the Discord.
561001583366635520,88,No_ she doesn't have any of the email accounts yet either_ just a hypothetical question.
561001952549535755,68,Ok_ if she does log into my Discord without my consent_ could I sue?
561002465013792774,98,Yeah I told her that it was my business and not hers_ but she acted like a stubborn ass like usual
