ID,Server,Channel,Content Length, Content
558108466359828527,r/teenagers,general-2-electric-boogaloo,32,So uhhhh the server's not for me
558108513231044629,r/teenagers,general-2-electric-boogaloo,41,Don't get me wrong_ some of ye's are nice
558108806828261398,r/teenagers,general-2-electric-boogaloo,174,It's probably because the server is so big_ but there is just chaos especially on <#235888301930708992> and <#212597110770630656> . No one knows which one is talking to whom.
558109241588842507,r/teenagers,general-2-electric-boogaloo,32,I bid my farewell to this server
558109279048040518,r/teenagers,general-2-electric-boogaloo,22,It was fun for a while
558109296609460227,r/teenagers,general-2-electric-boogaloo,12,Arrivederci.
