ID,Author,Channel,Content Length,Content
560955560216756224,DX2,minion_masters_general,32,Reboomer makes boomer irrelevant
560962685848649730,fdmfdm,minion_masters_general,68,I mean most of those 8 hours is just grinding pas the lower ranks XD
560962781042573327,Hayazo,minion_masters_general,19,its all bcs ure bad
560962824369602570,Hayazo,minion_masters_general,84,if u were as good as me_ would took u 2 hours less <:datensKappa:511442526419550208>
560962902970990592,fdmfdm,minion_masters_general,45,go ahread_ stream the grind from wood to GM 😄
560962958260436992,Hayazo,minion_masters_general,66,i have no time for that im sorry <:datensKappa:511442526419550208>
560962988035670028,fdmfdm,minion_masters_general,27,<:Puffa:500302539468832788>
560963013159419916,Hayazo,minion_masters_general,19,no_ like really atm
560963274292723734,Hayazo,minion_masters_general,309,dont feel like streaming tomorrow. saturday my uncle had b-day so im gonna drink for sureNLsunday gonna be dying.NLmonday im going on talk about jobNLif it hits_ i wont have time and sources to stream_ cuz ima change place i will live in_ with definitely not good enough internet to stream_ at least at beginning
560963327820562433,fdmfdm,minion_masters_general,22,I know the feeling tho
560963346824691731,fdmfdm,minion_masters_general,39,we are moving to another office at work
560963397366185986,fdmfdm,minion_masters_general,60,and saturday one of my fav bars is having a birthdayparty XD
560963413669576714,fdmfdm,minion_masters_general,26,so I will die this weekend
560963517373480971,Hayazo,minion_masters_general,54,i see our plans for weekend are quite close each other
560963523992223758,Hayazo,minion_masters_general,2,XD
560963830646308905,fdmfdm,minion_masters_general,1,😄
560964677782339584,Hayazo,minion_masters_general,22,not this form of dying
560964824906072075,Hayazo,minion_masters_general,133,day after party is like living on sahara.. no matter on weather/season.. all u need for hapiness is lot of water... and silence.. LUL
560964988341059614,TomatoMato,minion_masters_general,45,I see you lived in Sahara for quite long time
560979512209440788,sunless,minion_masters_general,27,<:puffO:555028288461078536>
560985192681177127,MEE6,reddit-posts,0,
560990269684842497,Meno,minion_masters_general,35,like_ it's one thing to incentivise
560990329696681984,EricisFreaker,minion_masters_general,8,whats cs
560990424957714442,Meno,minion_masters_general,116,but after the dball nerf then rabid prowler then crystal construct then batsbatsbats then shieldguard and now stormy
560990578796396546,Meno,minion_masters_general,162,there hasn't been a card release since WHEEL OF DOOM that hasn't had at least 1-3 cards in the release pool required to be drastically nerfed in a very short time
560990588711731202,Meno,minion_masters_general,16,let that sink in
560990709327593485,EricisFreaker,minion_masters_general,33,wait how is stormy getting nerfed
560990791846068224,Meno,minion_masters_general,48,he's already been nerfed via the guardian change
560990832274964501,Meno,minion_masters_general,51,and will almost certainly be nerfed again very soon
560999005690265620,EricisFreaker,minion_masters_general,0,
560999042364997634,EricisFreaker,minion_masters_general,11,3 times now
560999080998731776,EricisFreaker,minion_masters_general,21,1 from the house keys
560999100997435415,EricisFreaker,minion_masters_general,31,1 from random legendary in shop
560999124883734563,EricisFreaker,minion_masters_general,20,now from power token
560999464798781466,Thighlander,minion_masters_general,3,lol
560999471312535572,Thighlander,minion_masters_general,8,congrats
560999828671299605,★puesmira★,minion_masters_general,5,jelou
561000341613576208,★puesmira★,minion_masters_general,38,<:Puff_Switzerland:555034544256974852>
561000358592118815,★puesmira★,minion_masters_general,2,:c
561000655435857970,★puesmira★,minion_masters_general,11,🇵 🇦 🇳 🇦 🇲 🇦
