ID,Server,Channel,Content Length,Content
558441167654748160,/r/SwordArtOnline,ln-spoilers,96,Eugeo's death happens so late into the fight. He dies and gives Kirito motivation to keep going.
558451344315514885,/r/SwordArtOnline,ln-spoilers,101,He dies after the fight_ but he spurs Kirito on by transmuting his blood to form the blood rose sword
558451376959520772,/r/SwordArtOnline,ln-spoilers,36,or red rose sword. I forget the name
560627199280021534,/r/SwordArtOnline,images,1,F
560627316233863190,/r/SwordArtOnline,images,79,Does that mean we won't be getting the 3rd movie of Heaven's Feel anytime soon?
560627368704606221,/r/SwordArtOnline,images,66,Also_ what is it with animation companies/authors and tax evasion?
560627404184354826,/r/SwordArtOnline,images,38,First it was the author of Log Horizon
560627417916637209,/r/SwordArtOnline,images,17,now it's Ufotable
