ID,Server,Channel,Content Length,Content
558846098488295435,Official Fortnite,battle-royale,40,Anyone know any scrim codes for tomorrow
558846208769261598,Official Fortnite,battle-royale,18,Scrim codes anyone
558846433944403971,Official Fortnite,battle-royale,21,SCRIM CODES NEED THE@
558847923677560864,Official Fortnite,fortnite-general,16,Scrims codes plz
558848830016061454,Official Fortnite,fortnite-general,25,Billy has the scrim codes
558849393655152640,Official Fortnite,fortnite-general,17,Who is a tfue fan
558849963728306177,Official Fortnite,fortnite-general,44,Pro scrims are going live on twitch tomorrow
558850102182150169,Official Fortnite,fortnite-general,34,Only streamers get to for this o e
559058328194646046,Official Fortnite,fortnite-general,9,What’s up
