ID,Content Length,Content
560600186682867712,75,Today_ A rich fucker just flat out told me "This is why no body likes you".
560600247512858624,65,That_ ladies and gentlemen_ is how to tell if someone is insecure
560600313560825867,64,If they act like an ass for no reason_ they are insecure as fuck
560600876490948616,84,So take it from me_ if you walk in front of someone and they say that_ they insecure
560602162229542914,76,i gotta disagree. If I'm standing still and he starts shit_ he got a problem
560602237773021216,48,Brother_ I was standing at my desk doing nothing
