ID,Server,Channel,Content Length,Content
560978911387844618,MINECRAFT,minecraft,36,who wants to play with me on a sever
560979436225167381,MINECRAFT,minecraft,84,i want some one to play with me i have no friends and ya so can someone play with me
560984408631410696,MINECRAFT,minecraft,41,dm me if u want to play minecraft with me
560984650315726865,MINECRAFT,multiplayer,41,dm me if u want to play minecraft with me
560985629400367104,MINECRAFT,multiplayer,39,dm me if u want to play sever. im on pe
560991674101399603,MINECRAFT,multiplayer,26,dm me if u want to play pe
