ID,Content Length,Content
560640859058470912,1464,My name is GalaxyDogeyayNLAll of y'all be callin' me Galaxy Do GayNLNow that's ironicNL'Cause i'm iconicNLAnd all you loons sound moronicNLLet's just move on before I need to drink a rhyme tonicNLNLsome call me ChefNLsome call me DogeNLsome call me GalaxyNLbut they all call me an XP God_NLso piss off with your "not really"NLNLI'm the god of XPNLMS Math just a delivery boy for AbhayNLHow about M Series?NLJust a robot programmed to say "Do Gay"NLRulez 1 doesn't even know what the words 'be' and 'to' meanNLNTS?NLTryna' be hard by saying the n word and actin' keen NLBut doesn't even sound tougher than a white beanNLNLYou're all dirt compared meNLI'm the XP God you aspire to beNLMy XP keeps growing like an oak treeNLYou want fame_ and I hold the keyNLNLI got fuckin' bitches all aroundNLBetter than- what was his name again? NLEuropean Sound?NLNLYou're all leechesNLI'm just trying to relax at the beachesNLUntil I get a notification NLsayin' "Start obeying"NLNLListen here buddy_ we ain't roleplayingNLI'm not stopping until you start repaying NLfor theNLtime it took me to write thisNLAlthough it's a shit dissNLBetter than your red pissNLI'm running out of time_ we better end thisNLYou ain't getting a single kissNLNLAll of y'all are fuckin' wannabesNLI'll lay it down simple as ABC'sNLBow down to your true kingNLI'll give it to ya soft so it doesn't stingNLAll your disses are thin as stringNLI surpass you in everything_NLyou're as delicate as a coral reefNLThis thing's over_ you better call an Air BNB.
560640894118658049,22,<@!467347955117064192>
560641106232999936,8,yes I am
560641122792374272,19,check my damn roles
560641196452478976,22,I was the first XP God
