ID,Channel,Content Length,Content
560610288303472642,apex_legends,6,oh wow
560983412530479104,apex_legends,87,I wish I had that gun every match_ It makes me feel like I can actually  kill something
560983702344040470,apex_legends,50,R301 and Spitfire are what I am always looking for
560984134261145620,apex_legends,88,Most of the time_ not all of the time_ it I end up with dissapointment and failure sadly
560984314217496587,apex_legends,12,gold barrel?
560984441921601566,apex_legends,35,that's nice but I rarely find those
