ID,Server,Channel,Content Length,Content
560984064203423754,MINECRAFT,technical-java,76,Anyone know if it's possible to load a coral reef in with a structure block?
560984927990972431,MINECRAFT,technical-java,42,I'm more asking if the parts exist already
560985138423660546,MINECRAFT,technical-java,143,As in_ the wiki says that the coralcrust folder exists_ but upon snooping in the 19w13a.jar structures folder_ no such coralcrust folder exists
560985281499496478,MINECRAFT,technical-java,4,crap
560985320590540810,MINECRAFT,technical-java,53,https://minecraft.gamepedia.com/Coral_reef#Generation
