ID,Content Length,Content
558994303620481035,13,Is that true?
558994397715234816,38,I mean what cuteness was refering too.
558994499628433418,19,I mean not cuteness
558994580234567680,47,This guy darn I'm so tired from last night lol.
558994584340922368,22,samasaurus6 - Polymaps
558994738401902613,58,Ik_ I use this on  constant bases in our marketplace maps.
558995064953765919,158,I was referring to what Polymaps said about new weapon guidelines that prohibited the plasma rifle from remaining in the pack?NLI wasn;t aware of such changes.
558995139931013210,52,I guess I'll go and look up the documentation again.
