ID,Server,Channel,Content Length,Content
558766355852034077,MINECRAFT,skins-n-textures,151,I will be starting to make a candy/sweets themed texture pack soon if anyone wants to help you can dm me. I don't want it to be too over the top though
558766435674095626,MINECRAFT,skins-n-textures,48,Like for instance I will make a cake back turtle
558766691547349022,MINECRAFT,skins-n-textures,28,And the sun will be a cookie
558767881383444484,MINECRAFT,skins-n-textures,3,Yep
558767917433356288,MINECRAFT,skins-n-textures,6,Yay me
558768788837761063,MINECRAFT,skins-n-textures,26,I'm not really experienced
558768825802293288,MINECRAFT,skins-n-textures,34,I don't really know what I'm doing
558768889551650837,MINECRAFT,skins-n-textures,25,I'm just doing it for fun
