ID,Server,Channel,Content Length,Content
559002983317110814,masterani.me,lounge,24,The garbage can liked it
559002997468692502,masterani.me,lounge,11,Wanted more
559003082269392908,masterani.me,lounge,18,I wanna see Typhon
559003125449752587,masterani.me,lounge,19,Tho that's doubtful
559003188716634145,masterani.me,lounge,34,Will probably only feature Echidna
559003236908924930,masterani.me,lounge,4,Wait
559003299764895745,masterani.me,lounge,26,Was Typhon witch of wrath?
559003423341543424,masterani.me,lounge,26,I just want witch of wrath
559003458057797646,masterani.me,lounge,26,The goodest if the witches
559003937684979722,masterani.me,lounge,16,Good spoon scene
559004037345968138,masterani.me,lounge,5,OVA 3
559004187782807592,masterani.me,lounge,23,They did mayonnaise OVA
559004210524586005,masterani.me,lounge,13,Y no spoon???
559005161364652034,masterani.me,manga,24,Y wud u read chibi SCPs?
559020906387603468,masterani.me,lounge,78,Sense on depth of words become really obscure once you've reached +4 languages
559021898919313460,masterani.me,lounge,27,Also in some parts of India
