ID,Content Length,Content
560640759699734568,12,I feel awful
560641109353824277,59,My mom expects me to do everything see thinks I cant handle
560641239461003264,59,Like she forgots I'm stuggling with depression  and anxiety
560641512912846848,67,She literally bug me for 2 weeks just to add a border to her resume
560642273272922112,197,she wants me to write a letter to say how I feel and pressure me to do it. Saying you know how it feels that you dont talk how you feel with me? When you talk to me do I do anything abusive to you?
560642369289060371,37,Like she tellung me everyday to do it
560642649464373248,37,Basically about my feelings and stuff
560642885414813706,3,Yep
