ID,Content Length,Content
560639719638171658,62,lmao epic literally fucked pubs. its no where near fun anymore
560640023968350247,79,iT eNcOurAges aGgReSsIvE pLaY. literally enourages people to w key more. gg mon
560640432971710471,83,this game isnt fun. epic just continues to fuck the game more and more every update
560640585145253888,59,lmao imagine tos is gonna stop people from selling accounts
560640761968984074,133,yea to the people that say they are openly selling accounts. not to the multiple websites and discords selling and trading them 🤷🏽‍♂️
560640873864495119,70,and tfues old account wouldn’t have gotten banned if he didnt tweet it
561004092931964928,103,BRO CAN YALL FIX THIS DUMBASS PARTY FAILED TO CONNECT I HAVE TO RESTART MY GAME EVERY 5 FUCKING MINUTES
561004684400263180,63,bro me and my friend literally cant play the cup. WHYYYTYY*(*()
