ID,Author,Content Length,Content
558445499376467968,oliviayellowcat,58,THE BILLY BATSON EOISDOE IS COMING OUT ON THE FIRST!!!!!!!
558445524995538958,oliviayellowcat,18,ABIRL FIRSBTR~!!!!
558755055633956875,oliviayellowcat,22,hehehe i got a booster
558757679967764500,Eliazar,3,ooh
558796186094665751,oliviayellowcat,18,SOME EXPLAIN TO ME
558796208970399744,oliviayellowcat,31,WHY THE UNIKITTY CLOSI NG THEME
558796244386840576,oliviayellowcat,46,IS THE SAME AS PART OF LOGICAL SPACE JOURNEY??
558796257938767928,oliviayellowcat,43,https://www.youtube.com/watch?v=KPxLBqY78HE
558796268378259457,oliviayellowcat,43,https://www.youtube.com/watch?v=EoHmzAJXjqs
559022674777735169,oliviayellowcat,87,the dcsg next episode which comes out on sunday is about hal jordan and star sapphire!!
