ID,Channel,Content Length,Content
560954738846334977,fortnite-general,35,what’s good with this shitty update
560954947248717834,fortnite-general,33,no one who’s not a casual doesn’t
560955139947495467,fortnite-general,69,this update is pretty much a fat middle finger to solo squanders lmao
560955224336891934,fortnite-general,9,squaders*
560955332969365544,fortnite-general,50,u can’t place traps when u box someone now i think
560955748876812291,fortnite-general,3,yes
560962366439686175,fortnite-general,40,i feel like they’ll revert the update fr
