ID,Content Length,Content
559097916975874077,54,Best landing ever_ land and knock yuourself_ gg man gg
559098115244949515,53,man_ they don't wanna no lifer like others_ thats all
559107044720902145,78,Vault_ Turrets_ Dual Pistols_ P90_ Sileced SMG and bring back the tactical SMG
559107177567092746,39,<@421466696692269068> go ahead_ tell me
559107335239499787,57,tactical SMG is less broken from all SMGs in game so_ no.
559109205013823492,106,They fixed a lot of thing_ they are working hard i believe_ just don't stop_ this game is never gonna die.
559109678257143828,147,hey man_ you can't even talk about that_ since some people change they resolution in fortnite files to make the game easier_ that tells everything.
