ID,Server,Channel,Content Length,Content
558770661557010472,Official Fortnite,creative-discussion,199,Place the generator_ and drop the wished Item beneath it. He will suck it up_ and display it as a hologramm. In the settings (of tve generator) you can say how long the cooldown between itemspawn is.
558770784722616331,Official Fortnite,creative-discussion,45,Or I think so_ I don't have fortnite open rn.
558770903152852993,Official Fortnite,creative-discussion,25,STOP YOU LITTLE DIPS***IT
558772643575103514,Official Fortnite,fortnite-general,64,Can somebody delete the spam messages in <#520131316965179392> ?
558773240496128030,Official Fortnite,fortnite-general,198,Oh! You know what? The writer of the message himself can delete his messages! So... i like that you agree. (But you should do it then_ as that was a yes or no question_ and not asking for opinions.)
