ID,Server,Channel,Content Length, Content
558113143121903629,r/teenagers,memes,89,anybody: literally anything that isn't a pictureNLBarackObeezy: take it elsewhere fuckhead
558114292042301489,r/teenagers,memes,60,it's a mental disorder/condition _because_ it's not logical.
558115640465162241,r/teenagers,memes,81,emotions frequently defy logic so it makes sense that a mental disorder would too
558115695389310996,r/teenagers,memes,48,especially a mental disorder related to emotions
558457614640480277,r/teenagers,memes,34,Rule whatever: english only_ fools
