ID,Content Length,Content
558764960759414803,62,Honestly_ trump is doing a terrible job as president right now
558765134676361226,92,I mean he's literally planning to spend our budget on a wall which will do virtually nothing
558765348854169610,39,I mean let's think about this logically
558765369251332096,18,If you build a wal
558765382123388941,5,Wall*
558765447084769302,76,Either swim around it_ fly over it_ there are many other things you could do
558765478944964608,41,It isn't difficult to immigrate illegally
558765633089568781,122,However_ when you get in the usa_ it will be difficult to do anything_ especially with trumps hatred of illegal immigrants
558765814904258575,137,I personally think it would be best if he let them come in_ especially for asylum_ considering countries like china and North Korea exist
558765887159664651,49,Though the effect on the economy could be drastic
558766023881392128,19,Or what we could do
558766142773002266,96,Is let anyone come in for any reason on the caviat that they join the military for a year or two
558766214537543703,63,It gets our body force up_ and helps with people seeking asylum
558766273199079425,39,No i mean they would live in a compound
558766574476066826,47,I mean I don't want the us to become russia 2.0
558766653756670002,80,Because rn russia is barely staying up considering what putin is doing over ther
558766977901133845,19,I worded that wrong
558767035379744828,52,I mean that free speech is basically null over there
558767084033802262,48,Therefore people don't really want to live there
558767152535175173,63,You can't make a meme about the church without getting arrested
558767235347382292,1,^
558767424527269888,25,I mean it's fairly stable
558767503497625600,93,Just with how free speech is over there_ things aren't really looking up for normal civilians
558767698637750279,94,That is definitely true_ though how they do that is ruining how people interact with eachother
558768070970048566,24,Iran is definitely weird
558768160157859850,45,I mean most of the middle east is tbh aandrew
558768342651895818,121,Considering how much terrorism is from there_ things aren't looking good_ especially from how that's making the area look
