ID,Content Length,Content
558463369577889794,33,Google ruined Minecraft Youtubers
558463652865245214,59,I had to stick Minecraft in my statement to stay on topic.ğŸ‘
559089079174823947,105,I like new features in Minecraft but I am afraid new features are going to make the game laggy eventually
559089872321904641,87,<@528290646264512533> yes and thatâ€™s a good thing. I hope Mojang keeps up the good work
560285739523375115,15,Xbox One and PC
560286541809844224,34,JavaScript and Java are different.
560287003413970944,47,I have only made cookies in Minecraft one time.
560288297641967627,78,<@307017843143081984>  Your theapist probably cries over Mincecraft music too.
