ID,Server,Channel,Content Length, Content
558111558966837249,r/teenagers,debates,6,murika
558111623454130197,r/teenagers,debates,47,assault weapon has no definition in US politics
558111678466883584,r/teenagers,debates,35,people call ar-15's assault weapons
558111696837672961,r/teenagers,debates,3,kek
558111718790791169,r/teenagers,debates,17,oh yeah of course
558111835262287872,r/teenagers,debates,10,FAMAS_ too
558111856636723230,r/teenagers,debates,29,i_ too_ know my cs;go weapons
558111926803234842,r/teenagers,debates,1,ğŸ˜¦
558111945287270400,r/teenagers,debates,3,rip
558112126636392448,r/teenagers,debates,33,the world revolves around america
558112137155706907,r/teenagers,debates,9,obviously
558113631468781578,r/teenagers,debates,18,idk my cheese tbh.
558113674921902090,r/teenagers,debates,63,but i always pick provolone when i go to subway does that count
558116966896762880,r/teenagers,debates,96,identify the root problems of the violence instead of just banning the tools used to execute it.
558116990502305792,r/teenagers,debates,3,tbh
558117692351971332,r/teenagers,debates,47,imagine living in a country with murika freedum
558117754998226945,r/teenagers,debates,20,lobbying is all good
558117767233142784,r/teenagers,debates,29,as long as money is out of it
558846050581086241,r/teenagers,debates,80,personally_ everyone should fix themselves so that humans can finally go extinct
559002805986263042,r/teenagers,debates,35,direct democracy has other problems
559002826513317888,r/teenagers,debates,30,mostly appears in larger areas
559002837300936722,r/teenagers,debates,17,demagoguing_ etc.
559003059397853218,r/teenagers,debates,85,it would fail to represent the states as a whole_ assuming we're talking about the US
559003145359851522,r/teenagers,debates,81,the new moves against the electoral college that states are taking is stupid_ imo
559003386931052544,r/teenagers,debates,23,>it does in switzerland
559003445034483736,r/teenagers,debates,47,switzerland is fucking small compared to the US
559003510926999563,r/teenagers,debates,60,imagine each state in the US being like a separate "country"
559003559203438593,r/teenagers,debates,74,giving up sovereignty in exchange for compromise and active representation
559003642955431937,r/teenagers,debates,64,direct democracy will not be compatible with a place like the US
559040121765101568,r/teenagers,debates,31,you **should** and **need to**.
559040244708802592,r/teenagers,debates,86,I mean_ if you want to be a productive member of society_ knowing the vernacular helps
559040252145172500,r/teenagers,debates,14,but ill scroll
559040254066163755,r/teenagers,debates,3,brb
559040571918909451,r/teenagers,debates,3,???
559040581817466898,r/teenagers,debates,9,it doesnt
559040624100245524,r/teenagers,debates,9,people do
559042368683245568,r/teenagers,debates,3,lol
559044890332233729,r/teenagers,debates,128,the trade war's a bit questionable_ but i think that it's necessary to have some economic protectionism especially against China
559044913610752011,r/teenagers,debates,46,that might not be the right term_ but whatever
559045176144953344,r/teenagers,debates,38,<@!325983451331166208> not necessarily
559045267551420426,r/teenagers,debates,176,a lot of people will pull the "privilege card" in discussion <@!325983451331166208> _ so it's part of the conversation these days what your ethnicity is_ as stupid as it sounds
559045311339954176,r/teenagers,debates,3,lol
559045399588110356,r/teenagers,debates,21,>enlightened centrism
559045435403141140,r/teenagers,debates,0,
559045563698511907,r/teenagers,debates,73,stating both the good and bad shit he's done is not middle ground fallacy
559045593448710144,r/teenagers,debates,54,that's called stating the good and bad shit he's done.
559045669466406922,r/teenagers,debates,19,>wapoNL>opinionNL>aoc
559045790316756993,r/teenagers,debates,43,opinion journalism in politics is a disease
559045933627736094,r/teenagers,debates,12,>john oliver
559045940909178880,r/teenagers,debates,10,>hard pass
559046051730817060,r/teenagers,debates,34,isn't he one of those "comedians"?
559046071704223747,r/teenagers,debates,32,late night politics is a disease
559046255779512333,r/teenagers,debates,138,fuck fossil fuels_ and if you think renewables can work for everything_ then that's misguided_ at least for now and the foreseeable future
559046284569477121,r/teenagers,debates,41,nuclear is half the reason i support yang
559046357235531782,r/teenagers,debates,23,fusion will be a while.
559046384922132518,r/teenagers,debates,36,it takes a metric fuck ton of energy
559046394875215898,r/teenagers,debates,15,but if we do it
559046412214730753,r/teenagers,debates,18,Okay_ that's epic.
559046598617858058,r/teenagers,debates,72,<@261177081600147457> fusing atoms together and getting energy from that
559047044111663155,r/teenagers,debates,41,build a giant solar panel around the sun.
559048816767270935,r/teenagers,debates,24,i like the way you think
559048898287632386,r/teenagers,debates,81,i can gain security knowing my cereal is made with corn fertilized with the dead.
559049001991667713,r/teenagers,debates,25,that's the circle of life
559049043284721676,r/teenagers,debates,48,from dust you were born_ to dust you will return
559049170892357632,r/teenagers,debates,54,we can work as a united planet so solve overpopulation
559049234704498698,r/teenagers,debates,61,this planet has enough resources to support around 11 billion
559049436601516034,r/teenagers,debates,51,yall think India gon be a world superpower by 2050?
559049482197532691,r/teenagers,debates,87,if so_ would it be a good investment for me to learn Hindi for our new indian overlords
559049645645496320,r/teenagers,debates,59,india's pretty fractured in terms of development_ isn't it?
559049673558458388,r/teenagers,debates,33,some areas are quickly developing
559049698988523540,r/teenagers,debates,37,some areas are still in archaic times
559049773521436715,r/teenagers,debates,31,<:pepethink:556454097633673247>
559049901950894100,r/teenagers,debates,51,isnt india working on a space program or something?
559049919810371615,r/teenagers,debates,32,<:shockthink:304786416028614659>
559052355228794889,r/teenagers,debates,88,when shit hits the fan_ and the broadcast system announces nukes coming in 15-30 minutes
559052377169068052,r/teenagers,debates,33,what's your guys' plans of action
559052419380674581,r/teenagers,debates,11,mine's die.
559052436854276106,r/teenagers,debates,4,same
559052578260779018,r/teenagers,debates,96,i live in the middle of rural nowhere though_ and the closest major city is a state away from me
559052613572755457,r/teenagers,debates,36,i think im safe from a direct strike
559052648947384320,r/teenagers,debates,46,but if i dont have food_ im fucked for fallout
559052741851348992,r/teenagers,debates,39,the closest major city to me is chicago
559052769575698442,r/teenagers,debates,21,and it's a state away
559052849716396032,r/teenagers,debates,1,^
559052883165708298,r/teenagers,debates,22,<@!267758977218117642>
559052924710289408,r/teenagers,debates,4,MOOD
559052929424687124,r/teenagers,debates,7,im safe
559052955379040257,r/teenagers,debates,28,at least for the first weeks
559052998290964530,r/teenagers,debates,7,but tbh
559053052460400682,r/teenagers,debates,100,i kinda prefer being direct striked as to slowly dying from radiation in the span of weeks to months
559053098488823811,r/teenagers,debates,36,doesnt sound like my kinda tango tbh
559053511606927372,r/teenagers,debates,22,or radiation poisoning
559053536873152522,r/teenagers,debates,28,and THATS before the cancers
559053951253872651,r/teenagers,debates,1,^
559054100122304541,r/teenagers,debates,79,i think the suckiest part of the nuclear holocaust is that i wont have internet
559054198923198474,r/teenagers,debates,16,thats even worse
559054225775263760,r/teenagers,debates,37,ill be disconnected from civilization
559054373322358804,r/teenagers,debates,100,if i were elected dictator of the world_ i would turn the entirety of the sahara into a nuclear farm
559054395078213643,r/teenagers,debates,38,and nuke the shit out of martian poles
559054618592673793,r/teenagers,debates,10,like legit
559057002936926220,r/teenagers,debates,28,https://youtu.be/Gm0u68qRZ0M
559057008901357578,r/teenagers,debates,11,death metal
559057014236643340,r/teenagers,debates,9,thoughts?
559057044573913149,r/teenagers,debates,44,<@!378627967435145219> human pleasure_ sure.
559057064345993216,r/teenagers,debates,42,self-control is the best course of action.
559057096662974480,r/teenagers,debates,9,"extreme"
559057112312053770,r/teenagers,debates,31,what the fuck kind of situation
559057122936225793,r/teenagers,debates,18,was he thinking of
559057148705767429,r/teenagers,debates,26,life or death masturbation
559057192616198151,r/teenagers,debates,18,nah im just meming
559057208957206528,r/teenagers,debates,40,sounds funny as fuck without context tho
559057219958734858,r/teenagers,debates,5,lmfao
559057300883505153,r/teenagers,debates,41,full celibacy is ascension into the self.
559057346291040282,r/teenagers,debates,42,<@557897915188903936> not all incels_ tbh.
559057359456960534,r/teenagers,debates,33,it's a factor for the toxic ones.
559057388682870801,r/teenagers,debates,45,ive just visited braincels for the first time
559057441577238539,r/teenagers,debates,82,most of the "normal" incels are just physically troubled people who can't get laid
559057511466926100,r/teenagers,debates,24,using humor as an outlet
559057538012807168,r/teenagers,debates,28,a bit unfortunate_ actually.
559057603473309707,r/teenagers,debates,15,yes_ of course.
559057611249418250,r/teenagers,debates,14,agency exists.
559057623530471450,r/teenagers,debates,26,they are not utilizing it.
559057916527640600,r/teenagers,debates,134,one point that ive seen and "agree"_ even if incels don't agree with this point. sexual decadency is a problem. incels are part of it.
559057936274685952,r/teenagers,debates,44,people need more self-control in their life.
559058030625292290,r/teenagers,debates,32,bullying makes the problem worse
559058042612875292,r/teenagers,debates,17,it emboldens them
559058178826960896,r/teenagers,debates,54,Incels are a part of sexual decadency_ in all reality.
559058217850765352,r/teenagers,debates,73,This new openness to fuck whenever you wish gives a sense of entitlement.
559058278680887347,r/teenagers,debates,20,not a debate_ really
559058292668891156,r/teenagers,debates,30,just a discussion about incels
559058428941565973,r/teenagers,debates,87,people who took the black pill and think they lost the genetic lottery in getting laid.
