ID,Server,Channel,Content Length,Content
558758932684865541,Official Fortnite,lfg-battleroyale-pc,27,need 1 more squad NAE 2kd +
558810521487409178,Official Fortnite,lfg-battleroyale-pc,22,DUO OR SQUAD 2KD + NAE
558811226839449602,Official Fortnite,lfg-battleroyale-pc,22,DUO OR SQUAD 2KD + NAE
558816447258951680,Official Fortnite,lfg-battleroyale-pc,29,need a duo or squad NAE 2kd +
558817106402213898,Official Fortnite,lfg-battleroyale-pc,29,need a duo or squad nae 2kd +
558835932879519744,Official Fortnite,lfg-battleroyale-pc,29,need a duo or squad 2kd + nae
558836376863244289,Official Fortnite,lfg-battleroyale-pc,29,need a duo or squad 2kd + nae
558851821183959051,Official Fortnite,clan-recruiting,246,Team Phoenix is recruiting.. Phoenix is a brand new team that is trying to have fun and learn more tricks we are a growing team as well we are recruiting 2kd+ players NAE if you are interested let me know dm me we also just made a youtube channel
