ID,Content Length,Content
560627544383291414,24,contrary to what you saw
560627563152539648,23,datenshi lost that game
560638693342445571,48,all fun and games till you run into 2x memestorm
560639945245589505,2,2x
560640074027630592,11,1800>2000 🤔
560640986729152543,83,I mean they arent going to not play a card when its only has one bugged interaction
560641059005399061,71,Combustion is pretty strong anyway since you cant counter the explosion
560641237464383488,89,unless they nerfed the time to combust you have to predict the combust to stop it in time
560642249327902731,131,I mean considering you have <1 sec to counter the combustion_ you need to be pretty fast and having any latency makes it impossible
