ID,Server,Channel,Content Length,Content
559012560385474560,Official Fortnite,battle-royale,85,hello. can someone help me download the mobile version of fortnite battle royale pls?
559012802896068609,Official Fortnite,battle-royale,11,android ofc
559012907908857896,Official Fortnite,battle-royale,69,i dont know how to download the mobile version of fortnite on android
559013004121997323,Official Fortnite,battle-royale,7,its not
559013099139760138,Official Fortnite,battle-royale,25,now i have a huawei phone
559013168131735601,Official Fortnite,battle-royale,66,i went to their website but they asking for my mobile phone number
