ID,Server,Channel,Content Length,Content
560948660398063617,Official Fortnite,fortnite-general,3,yes
560949195196858408,Official Fortnite,fortnite-general,44,infantry is just a bootleg AK but better tbh
560949576849162249,Official Fortnite,fortnite-general,64,40 damageNLNLhitscanNLNLno bloom at allNLNLcool reload soundNLNLseems ok
560949860463804417,Official Fortnite,fortnite-general,116,I like how people like siphon but epic removes it cause of "thirsting" even though there were so many ways to fix it
560950241235304448,Official Fortnite,fortnite-general,90,it was a problem in squads and duos but like I said there were soo many ways  to change it
560950401566900253,Official Fortnite,fortnite-general,96,<@559568157103226880>  epic is getting lazy lol. next thing u know they will kill their own game
560950705335304202,Official Fortnite,fortnite-general,97,lol what was worseNLNLinfinity bladeNLNLpre nerf p90NLNLremoval of siphonNLNLrocket damage through builds
560954608902602763,Official Fortnite,fortnite-general,31,CaN we MaKe ThE WoRm TrAvErSal?
