ID,Channel,Content Length,Content
558838185598124042,minecraft,74,hey guys i madee a new minecraft world if anyone wanna join i am on pc btw
558838398731681814,minecraft,62,my ip for my world is Ssleepy.minehut.gg if u wanna join dm me
558838702349221888,minecraft,49,Dm me if  u want to play with me on my new server
558838946449326095,minecraft,65,<@537201531175567360> my world is multiplayer if that what u mean
558839468229132300,multiplayer,44,any one wanna play with me on my new  server
558841944839815172,multiplayer,70,anyone wanna play on my survival server i just open today if yes DM me
558850998240804864,multiplayer,45,any one want to join my new server jav 1.13.2
