ID,Content Length,Content
558755087003025409,73,its nice until people start taking your work for free and for granted ;-;
558755358122835969,65,i had that feeling when i was making private discord bots for fun
558756106340532237,1,F
558756874955259926,41,does anyone even play those discord games
558758458611073056,54,im a hacker i hacked the page to say my name!11!111!11
558758534918176768,12,e.Z security
558758552387452960,32,googel im waiting 4 u to hier me
558758849507622922,25,tonald prump says im cool
558758876577660928,19,i mean donald trump
558759155834421281,57,i thought it was another array joke <@557006338459172874>
558759184749822027,22,jk i couldnt relate xd
