ID,Server,Channel,Content Length,Content
558762088340652044,MINECRAFT,technical-bedrock,30,can anyone answer my question?
558762276543397890,MINECRAFT,technical-bedrock,19,i was gonna post it
558762298672545803,MINECRAFT,technical-bedrock,22,it just takes a sec...
558762393841303556,MINECRAFT,technical-bedrock,7,really?
558762513093754880,MINECRAFT,technical-bedrock,46,any idea where i could find a tutorial for it?
558762587047723020,MINECRAFT,technical-bedrock,7,one sec
558762724981735450,MINECRAFT,technical-bedrock,88,i just make adventure worlds_ and would like to make some custom mobs with gear and such
558763057229070362,MINECRAFT,technical-bedrock,21,how could i get that?
