ID,Server,Channel,Content Length,Content
558458834415386624,/r/Anime Discord!,anime,80,Just finished binging all of naruto in about 3 weeks. My life is meaningless now
558459237987254322,/r/Anime Discord!,anime,18,on ep 2 of boruto.
558459290084704266,/r/Anime Discord!,anime,48,I'm to anime so im running through the main ones
558459365758074898,/r/Anime Discord!,anime,47,attack on titan_ one piece_ full metal alch etc
558459411983761438,/r/Anime Discord!,anime,41,hooked on the the naruto universr tho :('
558459513393512458,/r/Anime Discord!,anime,49,I just need the next season of BNHA to air sooner
558459694826651660,/r/Anime Discord!,anime,21,So far BNHA is my fav
