ID,Server,Channel,Content Length,Content
560610288303472642,Axis Order,apex_legends,6,oh wow
560983412530479104,Axis Order,apex_legends,87,I wish I had that gun every match_ It makes me feel like I can actually  kill something
560983702344040470,Axis Order,apex_legends,50,R301 and Spitfire are what I am always looking for
560984134261145620,Axis Order,apex_legends,88,Most of the time_ not all of the time_ it I end up with dissapointment and failure sadly
560984314217496587,Axis Order,apex_legends,12,gold barrel?
560984441921601566,Axis Order,apex_legends,35,that's nice but I rarely find those
560985619673776130,Axis Order,apex_legends,143,I met a duo of twitch streamers_ they had that fast paced gameplay style that you have.NLI hated the moments where I couldn't keep up with them.
