ID,Content Length,Content
558819207660175400,34,It may end up as an expansion item
558830928005431313,119,Since the Fishing Hook might come in the pirate llamas_ anyone that has it_ and know if it has any fun/unique #6 perks?
558831980297322505,72,Would it not be super logical for flintlocks to be in the pirate llamas?
558832015999238144,49,Not saying its a sure thing_ but it seems like it
558832328986722324,33,why would they not re release it?
558832630930472977,30,Oh_ thought you meant "at all"
558832718566391820,70,But dunno what they would have in pirate llamas if not flintlocks_ heh
559012452763959325,55,Bllrgh_ setting up tunnels before SSD's is anxious work
