ID,Content Length,Content
560637357091455015,30,I need to get my shit together
560637394538201099,26,I feel so constantly tired
560637468760735771,76,I almost don’t feel like a person sometimes_ just a conscious waste of space
560649928431632384,3,yes
560649959956021248,27,I need to hydrate much more
560649980889530371,10,also sleep
560977599258558485,16,what do you mean
560977686647013387,83,when your arguing about it with that specific person and they think it’s about them
560978887731838984,16,Are you head mod
560979036029845505,39,The idea of discord drama is cringe imo
560979122025922580,44,How tf are you arguing? What is he mad about
560979418923794461,11,what server
560979713754136617,57,Have you tried just not responding when he acts like that
560979818741760033,3,hmm
560979896185258000,43,sounds like someone venting on the internet
560980450496217088,18,Is this text or vc
560984742212665344,4,What
560984764945793044,4,Game
