ID,Server,Channel,Content Length,Content
559061094979600411,Official Fortnite,fortnite-general,4,shit
559061986210611237,Official Fortnite,fortnite-general,33,but but i am not selling accounts
559062076568633364,Official Fortnite,fortnite-general,18,i am selling skins
559062178972303420,Official Fortnite,fortnite-general,2,oh
559062316776423424,Official Fortnite,fortnite-general,28,ok what about gifting skins?
559062489837600769,Official Fortnite,fortnite-general,28,ok what about gifting skins?
559062713402261506,Official Fortnite,fortnite-general,22,my whole life is a lie
