ID,Server,Channel,Content Length,Content
558814415126921247,Official Fortnite,creative-discussion,44,Got a problem _ setting up game in creatives
558814473100460032,Official Fortnite,creative-discussion,81,My problem is that _ I want Team 1 to have only 25 HP _ while Team 2 have 2000 HP
558814509821591563,Official Fortnite,creative-discussion,51,I use team inventory thing and it doesn’t even work
558814577568251964,Official Fortnite,creative-discussion,55,I tried so many thing and it just not work how I wanted
558814593837695000,Official Fortnite,creative-discussion,11,Please help
