ID,Server,Channel,Content Length,Content
558828977381179403,Official Fortnite,fortnite-general,64,If someone wants to tryout for a clan add me my id is 1Ranger_Yt
558829611211948073,Official Fortnite,fortnite-general,64,If someone wants to tryout for a clan add me my id is 1Ranger_Yt
558829994516676633,Official Fortnite,clan-recruiting,57,Domeone want to tryout for a clan add my ID is 1Ranger_Yt
558832502240837653,Official Fortnite,fortnite-general,39,someone wants a clan feel free to dm me
558834560113180754,Official Fortnite,fortnite-general,101,sorry lewis but i cant write in the other one and if someone wants to join my clan feel free to dm me
558851512550424576,Official Fortnite,fortnite-general,10,clan dm me
