ID,Channel,Content Length,Content
558784596985249793,minecraft,49,is there a way to craft an armor stand with arms?
558784782952038400,minecraft,36,then can you not place axes in them?
558785364312195073,minecraft,41,are you allowed to send pictures in java?
558785392581541898,minecraft,13,in this sorrt
558792969831055360,minecraft,29,can you feed dolphins salmon?
558813848878972929,minecraft,24,how do turtle eggs work?
558814164102152242,minecraft,66,if you feed them sea grass at night do they lay eggs immiediately?
