ID,Content Length,Content
558802975384928279,140,hello guys fortnite is going to probely put out a new bow n airro so its going 2 be lit<:FN:332199960139530240> <:cuddle:504284810752294952>
558803141265719325,1,y
558803231115837441,14,wut hapen 2 it
558804041178808340,24,do u guys like jake paul
558804131507077123,8,yes i do
558804524022890514,52,there should be a free thing in fortnite on the shop
558804622857338882,20,im a kid y u hate me
558804754772525066,36,my friend said he can get free v bux
