ID,Server,Channel,Content Length,Content
560627826303303691,r/teenagers,debates,23,lets have a good debate
560627966619549707,r/teenagers,debates,20,frozen pizza is shit
560628031303974933,r/teenagers,general,12,fucking hell
560628098203254795,r/teenagers,general,45,yall acctually have physical porn downloaded?
560628198350651422,r/teenagers,general,29,90000000000000000000000000 iq
560628365992787978,r/teenagers,general,117,the best way tohide porn is probably naming it something like windows_drct and sticking it deep in the windows folder
560628417050181645,r/teenagers,general,17,ima pee in ur ass
560628506627801088,r/teenagers,general,33,yall actually know eachother lmao
560628657459167252,r/teenagers,general,98,https://www.reddit.com/r/teenagers/comments/b6c5ry/like_fucking_seriously_lego_needs_to_get_their/
560628668653764629,r/teenagers,general,10,pls upvote
