ID,Server,Channel,Content Length,Content
560621444195811348,r/teenagers,serious-personal,136,Usually self sacrifice isnt a looked at way to go out and many people have some sort of self preservation going on <@204813531525283841>
560621817040207882,r/teenagers,serious-personal,82,iPhones are good but I'm gonna go with Androids being better <@451547375442460672>
560622330372423690,r/teenagers,serious-personal,116,Yeah I get that going out as a hero but there are high chances that the flight instinct will kick in and you'll flee
560623596402114560,r/teenagers,serious-personal,27,It dont feel good Mr. Stark
560623683681648653,r/teenagers,serious-personal,22,Not much I just around
560623809313505281,r/teenagers,serious-personal,4,Hbu?
