ID,Channel,Content Length,Content
558832707908665367,save-the-world,86,can someone please give me nuts and bolts i have none i will trade something if needed
558833212999073822,stw-trade,35,[H] ANYTHING[W] NUTS AND BOLTS[P]PC
558843161103826955,save-the-world,19,im looking fow nabs
558843339110350869,save-the-world,17,ok but nowone has
558852612162846720,save-the-world,39,i realy need herbs and bacon and quartz
558861180404498442,save-the-world,53,will anyone help me do missions in stonewood im pl 18
558861456582377482,lfg-savetheworld-pve,41,can someone help me in stonewood im pl 18
558863161982451713,stw-trade,39,[H] ASK[W] HERBS_ QUARTZ_ AND BACON[PC]
