ID,Channel,Content Length,Content
558816242241110016,clan-recruiting,92,Hi my clan name is DDM Death DONT MATTER we’re looking for good players dm if you wanna join
559070141716103168,clan-recruiting,99,Looking for members for my clan DDM Death don’t matter must be good nae or naw dm if you wanna join
560623253014577153,lfg-battleroyale-console,73,Lf a duo for arena must have mic be good 80+wins nae dm if you wanna join
560624646488326153,lfg-battleroyale-console,97,Looking for a duo for arena event nae must be good must have mic nae 80+wins dm if you wanna play
560625009110941717,lfg-battleroyale-console,87,Looking for a duo for arena must be good must have mic 80+wins NAE Dm if you wanna play
