ID,Content Length,Content
560623253014577153,73,Lf a duo for arena must have mic be good 80+wins nae dm if you wanna join
560624646488326153,97,Looking for a duo for arena event nae must be good must have mic nae 80+wins dm if you wanna play
560625009110941717,87,Looking for a duo for arena must be good must have mic 80+wins NAE Dm if you wanna play
560629027824599050,139,Hi I’m looking for a official duo partner that will team up with me on arena nae must be good NAE 80+wins 12+yrs old dm if you wanna duo up
560630364066807808,99,Anyone wanna.be my official duo partner nae must be good must have mic 90+wins dm if you wanna join
