ID,Server,Channel,Content Length,Content
558862738517000202,MINECRAFT,support,29,Hey I need help with my realm
558862961385668637,MINECRAFT,support,129,I bought it yesterday night and it still says that its not available and they will make it when they can but it's been over a day
558863323404435471,MINECRAFT,minecraft,159,Hey I need help with my realm I bought it yesterday night and it still says that its not available and they will make it when they can but it's been over a day
558863821117325322,MINECRAFT,support,37,I tried to but they haven't responded
558864962865594399,MINECRAFT,technical-bedrock,159,Hey I need help with my realm I bought it yesterday night and it still says that its not available and they will make it when they can but it's been over a day
