ID,Server,Channel,Content Length,Content
558994218975232010,MINECRAFT,bedrock-store-feedback,51,Plasma Cutter > Space Rifle <@140368280148901888> 😄
558994269113679873,MINECRAFT,bedrock-store-feedback,38,Anything with plasma is the best space
558994333383000065,MINECRAFT,bedrock-store-feedback,16,I said it so yes
558994503512621066,MINECRAFT,bedrock-store-feedback,24,My comment still applies
558994521287950356,MINECRAFT,bedrock-store-feedback,1,😎
558994636820185090,MINECRAFT,bedrock-store-feedback,36,Afaik NBT access is used by partners
558994704310599684,MINECRAFT,bedrock-store-feedback,24,Not sure how much though
559034646193635348,MINECRAFT,bedrock-store-feedback,31,You can_ on PC and mobile afaik
