ID,Content Length,Content
561001152267812896,74,Lf2m nae. Preferably woman. Got 31.000 kills in-game and about 800 IRL. Dm
561003663183839232,76,Lf2m victims nae. Preferably women. Got 31.000 kills in-game and 800 IRL. Dm
561003949507870721,99,<@!464672246183493632> Lf2m victims nae. Preferably women. Got 31.000 kills in-game and 800 IRL. Dm
561004288235536416,23,Do you prefer men_ boy?
561004570252410888,98,If this is confusing already_ you’re probably not that clever. Kill yourself <@413141154033565698>
561005006719942687,68,Lf2m nae. Preferably women. Got 31.000 kills in-game and 800 IRL. Dm
561005419963744281,43,Join my team. I’ll take special care of you
