ID,Server,Channel,Content Length,Content
558991761670668300,Official Fortnite,save-the-world,31,Ill pay for someone to farm LOL
558991915559813130,Official Fortnite,save-the-world,65,No lolm_ dont say that last time i tried saying that I got banned
558992029347217419,Official Fortnite,save-the-world,54,Even though I was making a joke_ staff just.. you know
558992097999323164,Official Fortnite,save-the-world,12,trading? yes
558992203934990346,Official Fortnite,save-the-world,71,People say trading is dumb.. I think its very beneficial.. but not guns
558992258871984158,Official Fortnite,save-the-world,35,Materials are easy_ guns are stupid
558993309733879808,Official Fortnite,stw-trade,37,[H] 5000 nabs [W] 500 fiberous [P] pc
