ID,Content Length,Content
558854307043344424,61,no. never. no fantasy worlds_ no epic adventures. not for me.
558855066493255691,145,very much is. my online name for the last 35 years has been one version of one of the most epic fantasy heroes in all literature (and movies now)
558855232944078868,45,i am often reading or watching fantasy worlds
558858146047590402,88,Estel_ Thorongil_ Strider_ Dunadan_ Aragorn_ King Elessar Telcontar. a man of many names
558859479811358729,89,Dunedain are the rangers of the north. Dunadan is Man of the North and the Dunadan is him
558859571410632704,73,tolkien was way too verbose_ though i love his world the detail is insane
