ID,Channel,Content Length,Content
560637922026717205,minecraft,13,wow thats sad
560639635143786507,minecraft,41,hey_ smart minecrafters_ I got a question
560639671680368640,minecraft,54,what is a really smart way to power a redstone signal?
560639859866337312,minecraft,134,Smart minecrafters_ what is a clever way that not many people know about to power a redstone signal? (Like_ a really obscure way  : P)
560639916636241920,minecraft,4,Yes?
560639949578174489,minecraft,4,Okay
560640299026612224,minecraft,132,I already have something like that <@!269895895246569473> . Except without the chicken_ just a villager (I am making puzzle map : P)
560644074919428107,minecraft,73,fellas. I am nearly finished probably the hardest puzzle map in minecraft
