ID,Content Length,Content
558793267983155225,30,lf duos m8 .NLEu.NLNot that good
558793522753306648,39,<@!350957826207907841> wanna play duos?
558793851725152274,25,Lf duos eu.NLNot that good
558795088952819747,79,<@277585895916437505> royale bomber good enough hahahah.NLI am not that good tho
558813724283240451,26,Lf some rumble practise m8
558813861864669252,27,Lf Rumble practise duos.NLEu
558814357950169088,31,Lf some bad people to play with
559002636129665024,49,lf some people to play with.NLI am pretty bad.NLHmu
