ID,Server,Channel,Content Length,Content
558991094449307668,/r/SwordArtOnline,gaming,14,It's not Joker
559012375119003677,/r/SwordArtOnline,ln-spoilers,35,<@476176194518253569> wrong channel
559012766716002314,/r/SwordArtOnline,ln-spoilers,26,Consider reading the rules
560627118136885262,/r/SwordArtOnline,images,174,<@&329326764281036810> Can I get a motherfucking F in the motherfucking chat? https://www.reddit.com/r/anime/comments/b6b43y/ufotable_animation_studio_accused_of_tax_evasion/
560627616168804383,/r/SwordArtOnline,images,40,From the sound of it_ HF3 should be okay
560627652264853524,/r/SwordArtOnline,images,71,Seems the investigation and everything is going to take quite some time
560628642321793024,/r/SwordArtOnline,untranslated-spoilers,43,Kirito has friends with vaginas_ how horrid
560628876146114562,/r/SwordArtOnline,untranslated-spoilers,72,Didn't realize friend groups required equal numbers of males and females
560629476376182786,/r/SwordArtOnline,ln-spoilers,56,<@411367718046924814> Accel World spoilers don't go here
560630444589056014,/r/SwordArtOnline,untranslated-spoilers,5,False
560630515078529027,/r/SwordArtOnline,untranslated-spoilers,82,Eugeo would get sidelined just like every single other deuteragonist in the series
560630611811893248,/r/SwordArtOnline,untranslated-spoilers,21,On the grounds of...?
560630852627857410,/r/SwordArtOnline,untranslated-spoilers,80,I'm not sure what series you're reading_ but Asuna got sidelined pretty hard too
560631044047634442,/r/SwordArtOnline,untranslated-spoilers,26,Only took three story arcs
560631218140479518,/r/SwordArtOnline,untranslated-spoilers,98,Literally every other character gets shelved_ assuming Eugeo would be any different is nonsensical
