ID,Channel,Content Length,Content
558840369303912456,multiplayer,87,whoever wants an anarchy server with no rules (even hacks are allowed). Join my server:
558840987481276429,multiplayer,48,join my anarchy server AverageAnarchy.aternos.me
558841948044001291,multiplayer,51,who wants to join my anarchy survival server 1.13.2
558842641328898049,multiplayer,53,whoever wants to join my anarchy server_ dm me for IP
558853193577267230,multiplayer,75,we need more players in our anarchy server_ IP is AverageAnarchy.aternos.me
558854796413632512,multiplayer,57,AverageAnarchy.aternos.me join for survival with NO RULES
558992400538927106,minecraft,14,*expands dong*
559034442920755200,multiplayer,85,who wants to join my new anarchy server with a cap of 20 players rn_ DM for IP (Java)
560985544675426306,multiplayer,79,looking for people to join my new anarchy server (1.13.2 Java) DM if interested
560986080921518083,multiplayer,33,looking for people to join my 1.1
