ID,Channel,Content Length,Content
559110495701827594,save-the-world,37,Nice_ I just got my twine ssd5 reward
559110549045116958,save-the-world,49,after doing the ex-mainquest-sidequest-stuff pl94
559110623405801512,save-the-world,44,now onto the last few pl100 missions I guess
559112542295687229,save-the-world,15,GET OFF MY LAWN
559112682062610442,save-the-world,65,got my grave on water.... wanted the grave digger to be.... cool.
560948627283902520,save-the-world,3,wat
560949315451879434,save-the-world,5,ite 🙋
560949436025667585,stw-images,67,airheart has war of the rose and can be used instead of OP coconuts
560963199457951744,save-the-world,21,You're from BR right?
560963540786216960,save-the-world,54,canny SSD was the most "fun" or rather challenging imo
560963597296205836,save-the-world,36,tunnels can be pretty funky in canny
