ID,Content Length,Content
560637298585108492,94,i need someone whos good with permissions and can help me with itNL(using perms ex)NLJavaNLDM Me!
560638849563230227,207,I need some help with a **FACTIONS** server!NLI need a few people who know how to manage permissions_NLI need a few people to moderate_NLand I need a few people to test it out!NL**DM Me!**NLI am using Java 1.12.2
560651751049658373,132,I need some people to be moderators for my **Factions** server!NLI also need some people to be  testers!NLDM me if you are interested!
560652963039805450,122,```diffNL- I need some help with my factions server! DM me if you are interested! Ask me any questions you have in dms.NL```
560653879235051523,23,hypixel bedwars anyone?
561001133213220865,68,looking to start a factions server with someone dm me ill host it :D
