ID,Content Length,Content
559052369674108944,19,Hermitcraft videos.
559052517913133076,50,They build lots of weird and awesome things there.
559052843970068493,95,Well the trick is to use some of their techniques and philosophies on your own original builds.
559053040305307681,113,Like this is an interesting roof idea_ you can use it on anything that's supposed to be remotely like that style.
559053555370164257,111,Or here's another style of buildings I haven't seen a bunch of people do. I don't even know what you'd call it.
559053805962919952,61,My friend said it looked vaguely French but I don't know lol.
559054196880703488,98,But yeah basically just figure out a style for each build so it doesn't look like random junk lol.
559055068473851944,84,And for terraforming_ I really like GoodTimesWithScar. He does awesome insane stuff.
559077877983871006,98,I mean_ if we had wall versions of almost every block_ those would basically be vertical slabs. ;)
