ID,Channel,Content Length,Content
558846839298850827,movie-night,24,love_ is a burning thing
558846937512673320,movie-night,26,and it makes_ a fiery ring
558847007054102529,movie-night,21,bound_ by wild desire
558847139317284897,movie-night,57,i felll into a burning ring of fireNLI went down down down
558847247635447809,movie-night,26,and the flames went higher
558847411775209483,movie-night,24,and it burns burns burns
558847497037021204,movie-night,35,the ring of fire_NLthe ring of fire.
558848474150338593,movie-night,14,it still burns
