ID,Server,Channel,Content Length,Content
558444067168583680,Official Fortnite,stw-questions,77,Would fire rate perk decrease the time it takes to charge the noble launcher?
558447842977644578,Official Fortnite,lfg-savetheworld-pve,65,looking for ppl to help with plank 7 i kinda sadly want a br skin
558449037741785108,Official Fortnite,lfg-savetheworld-pve,47,ok ill inv u when i finish the mission im in ty
558449886782160896,Official Fortnite,lfg-savetheworld-pve,41,lmao i mean ssd's dailies_ mission alerts
558758665667215392,Official Fortnite,stw-images,16,StW cOnTeNt OnLy
559110190423736321,Official Fortnite,stw-images,71,Mw make the gun full crit or its pretty much a reskin of a siegebreaker
560600769682866176,Official Fortnite,stw-images,6,How tf
