ID,Channel,Content Length,Content
558448745352527873,off-topic,28,Any girls here I need advice
558781382122405888,off-topic,29,Any girls on here need advice
558786283942445098,fortnite-general,13,Any girls on?
558798767302770721,clan-recruiting,6,Ok naw
558799471182348300,off-topic,32,Any girls on I need advice DM me
558799839022809089,fortnite-general,32,Any girls on I need advice dm me
558809088566362112,off-topic,27,I need advice_ any girls on
558832204340527134,off-topic,29,Any girls on I need advice dm
