ID,Content Length,Content
559072579630137344,61,Count how many enemies you can find in Earthbound Beginnings.
560285420919717890,13,Concrete Man.
560285574330581016,49,Professional Concrete Build- Tom skipped leg day.
560285760193036297,14,Anything goes!
560285786466025483,12,Even salami!
560285871224651798,20,You gotta be stoned.
560285973477588996,42,And I know exactly how to stone you two...
560286207712690202,30,Wasn't Net Neutrality a thing?
560286326650437632,39,Forgot completely about Net Neutrality.
560599213918912554,5,So...
