ID,Server,Channel,Content Length,Content
558432737736917005,MINECRAFT,multiplayer,65,<@300221108177862656> don't join him he's gonna ban you and block
558443351641292801,MINECRAFT,multiplayer,54,Someone please help me how to set up a server!!! DM me
558443944669609996,MINECRAFT,multiplayer,65,Can someone pleasee help me setting up a server with minigames!!!
558447347328221185,MINECRAFT,multiplayer,87,Yo can anyone help me setting up my server with minigames and a spawn and more stuff???
558765055114608653,MINECRAFT,multiplayer,77,I need someone that knows alot about how to add minigames and stuff (aternos)
558768452672946176,Official Fortnite,clan-recruiting,26,Astral ClanNLThe clan is EU
558768495869820928,Official Fortnite,fortnite-general,3,oof
558768663986044941,Official Fortnite,fortnite-general,89,I tried to make a clan message but i accedently posted it so i can't post another one -_-
