ID,Channel,Content Length,Content
560609906684723232,stw-questions,27,is the raiders revenge good
560638451259539456,stw-questions,75,are you able to start crafting 82's after you do the first canny valley ssd
560638640154214440,save-the-world,50,y'ever just ask for fairly valuable items for free
560640400193224751,stw-trade,72,[H]6 star mats are completely useless[W]something actually useful[P]XBox
560990656734953472,save-the-world,90,I got scammed_ so I'm gonna ask for free things because I'm too lazy to do anything myself
560991048168374272,stw-questions,32,when can you start crafting 82's
560991280134357004,stw-questions,37,so like after the first sed in canny?
560991312527228956,stw-questions,3,ssd
