ID,Server,Channel,Content Length,Content
558427804568518686,r/teenagers,serious-personal,79,it just kind of sits in your mouth and then you blow the smoke out_ smelling it
558427844670390272,r/teenagers,serious-personal,17,or smth like that
558428629923790848,r/teenagers,serious-personal,50,Closest to an ivy I could get are the Public Ivies
558428680636858369,r/teenagers,serious-personal,60,I did get into a Little Ivy but I can't afford the education
558429415563067392,r/teenagers,serious-personal,2,Uh
558429419254054912,r/teenagers,serious-personal,5,what?
558429449771548690,r/teenagers,serious-personal,26,Can't relate with this lol
558429854568153100,r/teenagers,serious-personal,75,The closest to an acid trip I will get is listening to Echoes by Pink Floyd
558430504282619918,r/teenagers,serious-personal,5,it is
558430546074533918,r/teenagers,serious-personal,50,My aura is shit because I already have visual snow
558430586033799180,r/teenagers,serious-personal,45,So when a migraine shows up it just is horrid
558430672218488834,r/teenagers,serious-personal,16,Sleep paralysis?
558430702400438294,r/teenagers,serious-personal,2,ah
558431141481414667,r/teenagers,serious-personal,72,Darkness is horrible because my visual snow peaks and I get a light show
558431307005296661,r/teenagers,serious-personal,32,I have to sleep with my phone on
558431341201588225,r/teenagers,serious-personal,39,Normally listen to ASMR or smth calming
558431369177464865,r/teenagers,serious-personal,19,Tinnitus is a bitch
558431651047145473,r/teenagers,serious-personal,23,I'm basically like Baby
558431691320983552,r/teenagers,serious-personal,62,Earbuds in most of the time with music on to help drown it out
558432244390297613,r/teenagers,serious-personal,71,https://i.imgur.com/mpYwKfr.png yeah this is as loud as I put music now
558432252921511937,r/teenagers,serious-personal,16,with speakers on
558432264623489044,r/teenagers,serious-personal,20,It's not loud at all
558432315009925131,r/teenagers,serious-personal,35,You probably don't work on 2 easily
558432330017013760,r/teenagers,serious-personal,29,Your body just got used to it
558432394005315620,r/teenagers,serious-personal,94,I thought I could handle 2 or 4 just fine_ then college hit and now I'm getting 7-9 each night
558432526503378944,r/teenagers,serious-personal,36,ASMR is all I listen to when I sleep
558432613388386336,r/teenagers,serious-personal,53,PC sounds on 50%_ spotify on 50% vol with speakers on
558432648796700672,r/teenagers,serious-personal,42,the music is audible but still quite quiet
558432850915885066,r/teenagers,serious-personal,38,Right now_ with how my sound is set up
558432884743077889,r/teenagers,serious-personal,39,my laptop is putting out sound at 50 db
558432905207218196,r/teenagers,serious-personal,20,so_ its really quiet
558433872220651520,r/teenagers,general,27,I never could get into joji
558434159694184467,r/teenagers,general,87,I mean I'm bi so it's different for me_ but a trap is literally the best of both worlds
558434172230696960,r/teenagers,general,25,body of a girl and a dick
558434445321830400,r/teenagers,general,118,Sounds like something my sister would say... "Dayton you can't call that 7 year old girl "honey"_ that's misogynistic"
558434514502680576,r/teenagers,general,89,Like sis I was giving the girl her first place trophy for the wrestling tourney calm down
558434681410945040,r/teenagers,general,72,idk_ for me i think there's a difference between a trap and a trans girl
558435027877101589,r/teenagers,serious-personal-2,143,https://open.spotify.com/track/6rz8k4FrzNs33CUUxPqiW7?si=ChuFnoctSOO107AU_ozW_w Haven't heard this song in like 8 years holy fuck the nostalgia
558435137449361419,r/teenagers,general,143,https://open.spotify.com/track/6rz8k4FrzNs33CUUxPqiW7?si=ChuFnoctSOO107AU_ozW_w Haven't heard this song in like 8 years holy fuck the nostalgia
558435551297011712,r/teenagers,general,22,What song is that from
558435622008782878,r/teenagers,general,2,ah
558435689654517760,r/teenagers,general,67,I've tried to like Eminem since my gf loves him but I just... can't
558435805236822017,r/teenagers,self,47,That's actually not that bad Dappy_ I like that
558435970769223680,r/teenagers,serious-personal-2,17,You're still dead
558436004558798851,r/teenagers,serious-personal-2,38,there are no technicalities with death
558436300269813791,r/teenagers,serious-personal-2,63,Dying in your sleep is just going to sleep and you dont wake up
558436349557080064,r/teenagers,serious-personal-2,12,^^^^^^^^^^66
558436420205936691,r/teenagers,serious-personal-2,108,The fact that there is nothing after death is the only reason why I can fathom why religion is still a thing
558436458399006751,r/teenagers,serious-personal-2,59,It offers solace for the fact that nothing actually happens
558436633284706333,r/teenagers,serious-personal-2,178,Yes but what's more realistic_ black nothingness after death like there was before birth or a giant man in the sky that sends people he loves unconditionally to burn for eternity
558436717502267424,r/teenagers,serious-personal-2,84,idk_ my entire philosophy for religion is basically George Carlin's skit on religion
558436748003115013,r/teenagers,serious-personal-2,20,I'm very anti-theist
558436827753611285,r/teenagers,general,16,I LOVE THAT SHOW
558437023480938520,r/teenagers,serious-personal-2,29,Religion is just a giant scam
558437059564666880,r/teenagers,serious-personal-2,26,How'd the Carlin quote go?
558437107891175426,r/teenagers,serious-personal-2,321,"Religion convinced the world that there's an invisible man in the sky who watches everything you do. And there's 10 things he doesn't want you to do or else you'll to to a burning place with a lake of fire until the end of eternity. But he loves you! ...And he needs money! He's all powerful_ but he can't handle money!"
558437382416891916,r/teenagers,serious-personal-2,93,"He's all-powerful_ all-perfect_ all-knowing_ and all-wise_ somehow just can't handle money!â€
558437445197234187,r/teenagers,serious-personal-2,45,idk_ I'm just for the abolishment of religion
558437514357112832,r/teenagers,serious-personal-2,62,it's a giant scam on every side and it delays so much progress
558437637220728844,r/teenagers,serious-personal-2,82,Yes_ humans make it a scam_ but guess what religion is? A human made belief system
558437744951558157,r/teenagers,serious-personal-2,121,Not really religious freedom considering the people who moved to America persucuted anyone who didnt believe in their god
558438147663462400,r/teenagers,serious-personal-2,22,morality is just... eh
558438205255581705,r/teenagers,serious-personal-2,68,I'm sorta objectivist_ I'm gonna end the conversation on my end here
558438242136096769,r/teenagers,serious-personal-2,47,Don't wanna go down an argument rabbit hole lol
558438577306861624,r/teenagers,serious-personal-2,39,Look up Objectivism_ Ayn Rand's version
558438639483224065,r/teenagers,serious-personal-2,29,I believe a lot of that stuff
558438720290816011,r/teenagers,serious-personal-2,88,But I'm aware that's like a major teenager hallmark so I'm probably gonna grow out of it
558438737525080064,r/teenagers,serious-personal-2,31,But for now it's what i believe
558438977993048085,r/teenagers,serious-personal-2,71,My belief system is the bastardized child of Ayn Rand and George Carlin
558439040777584660,r/teenagers,serious-personal-2,51,Those two had the biggest influence on me as I grew
558439090618630146,r/teenagers,serious-personal-2,30,Oh yeah_ Thomas HObbes as well
558439125242609666,r/teenagers,serious-personal-2,27,Always forget about him lol
558439176907784192,r/teenagers,serious-personal-2,10,Sarcastic?
558439218108694528,r/teenagers,serious-personal-2,2,ah
558440193565261832,r/teenagers,serious-personal-2,74,My numbers are decently high i the first one if you look at my old account
558440478958288906,r/teenagers,serious-personal,75,People just need to learn to not give a fuck and care about only themselves
558440489423077406,r/teenagers,serious-personal,25,Makes life so much easier
558440523115921419,r/teenagers,serious-personal-2,21,I posted a lot before
558440538374930453,r/teenagers,serious-personal-2,18,I complained a lot
558440554862477322,r/teenagers,serious-personal-2,32,Used to be a laughing stock here
558440580472897546,r/teenagers,serious-personal-2,21,Left_ for like a year
558440617898934282,r/teenagers,serious-personal,27,I used to be a regular here
558440629076754443,r/teenagers,serious-personal,18,like... a year ago
558440753131421737,r/teenagers,serious-personal-2,11,is that me?
558440942185480203,r/teenagers,serious-personal-2,33,wish I could see my old count lol
558441180812017684,r/teenagers,serious-personal,14,Twenty I think
558441209182420992,r/teenagers,serious-personal,11,Twenty#8833
558441311032574006,r/teenagers,serious-personal,5,I did
558441364686110740,r/teenagers,serious-personal,59,that acct is also banned because me and friends were stupid
558441647827058688,r/teenagers,serious-personal,29,Just say fuck you to his face
558441860109041674,r/teenagers,serious-personal,101,I follow my dad's advice... basically "only care about yourself and your family_ no one else matters"
558441949476945920,r/teenagers,serious-personal,80,Makes life really easy if "friends" just drop me from the group over stupid shit
558441975037296641,r/teenagers,serious-personal,48,and they then get pissed that I'm not hurt by it
558442141106307072,r/teenagers,serious-personal,37,Just make sure you win if you do that
558442225433051136,r/teenagers,serious-personal,43,Nah an ass beating works wonders most times
558442233410617358,r/teenagers,serious-personal,20,You just have to win
558442422892232705,r/teenagers,serious-personal,55,Current generational trend is that people love assholes
558442556749512714,r/teenagers,serious-personal,105,Right now people love assholes_ people love anti-intellectualism and being dumb_ and people love fakeness
558442580749320195,r/teenagers,serious-personal,30,At least this is what I notice
558442903890952193,r/teenagers,serious-personal,35,I mean I just hate everyone equally
558443017506258994,r/teenagers,serious-personal,126,I hate blacks I hate whites I hate asians I hate jews I hate christians I hate athiests I hate smart people I hate dumb people
558443061902966795,r/teenagers,serious-personal,23,I hate everyone equally
558443164818472980,r/teenagers,serious-personal,50,Only people I like are my family members and my SO
558443189632106498,r/teenagers,serious-personal,46,Those are the only people that actually matter
558443227464859679,r/teenagers,serious-personal,3,^^^
558443383732043776,r/teenagers,serious-personal,110,"The opposite of love is indifference. If you hate someone that means you care enough about them to hate them"
558443469769539595,r/teenagers,serious-personal,32,See I'll disagree with you there
558443620668276746,r/teenagers,serious-personal,14,It really does
558443643984412727,r/teenagers,serious-personal,45,You just need to learn to not care about them
558443675361738754,r/teenagers,serious-personal,47,Learn to not give any form of a shit about them
558443698074157067,r/teenagers,serious-personal,30,Don't care if they live or die
558443752901836801,r/teenagers,serious-personal,47,Don't care if they're in school or sick at home
558443776411172884,r/teenagers,serious-personal,17,Just _don't care_
558444616941043742,r/teenagers,serious-personal,27,We get on average 8 decades
558444633596887071,r/teenagers,serious-personal,31,You've almost wasted 2 of those
558444863276843048,r/teenagers,serious-personal,29,thats why we say _On average_
558445300788887555,r/teenagers,serious-personal,61,High School is better than college right now in my experience
558445393210507285,r/teenagers,serious-personal,82,The classes and learning experiences_ at least_ are much better in hs than college
558445550291386368,r/teenagers,serious-personal,38,party schools are a waste of money imo
558445562882424832,r/teenagers,serious-personal,29,I'm going to college to learn
558445585745838080,r/teenagers,serious-personal,31,not to waste time getting drunk
558445606276694016,r/teenagers,serious-personal,31,I've legit yet to go to a party
558445651965509664,r/teenagers,serious-personal,10,not really
558445717023096862,r/teenagers,serious-personal,32,I've branched out and met people
558445742302167060,r/teenagers,serious-personal,39,Formed a small friend group_ have an SO
558445750665871401,r/teenagers,serious-personal,11,I'm content
558445809209835547,r/teenagers,serious-personal,113,Now I want to transfer to go to a college with better learning experiences because I want to be a history teacher
558445976373690370,r/teenagers,serious-personal,153,All I really truly care about right now is getting the best grades I can so that i can go to  a good grad school overseas and then teach in a high school
558446052756291586,r/teenagers,serious-personal,30,That is my life plan as of now
558446211338862609,r/teenagers,serious-personal,181,Maintain at least 3.4 GPA throughout college_ transfer to Trinity of Dublin_ Durham_ or even UofT_ get my masters in Edu and History_ then apply for a teaching position at my old hs
558446292469022720,r/teenagers,serious-personal,19,You probanly wouldn
558446343165837352,r/teenagers,serious-personal,29,Jail gives you free amenities
558446364892069908,r/teenagers,serious-personal,22,Poor gives you nothing
558446430872666143,r/teenagers,serious-personal,14,Don't say that
558446450510659625,r/teenagers,serious-personal,16,You really can't
558446466822045696,r/teenagers,serious-personal,14,Stay in school
558446497855963146,r/teenagers,serious-personal,28,Learn to live_ live to learn
558446509666861056,r/teenagers,serious-personal,27,Learn to think and question
558446547075858432,r/teenagers,serious-personal,35,then go to college_ learn even more
558446714885767178,r/teenagers,serious-personal,61,Same_ and being screamed at by my father helped me understand
558446803440107556,r/teenagers,serious-personal,93,Everything you learn in high school is integral to your life no matter what field you go into
558447012622762006,r/teenagers,serious-personal,45,Its not the fact that it's GOING to be useful
558447040334659595,r/teenagers,serious-personal,37,It's that it TEACHES YOU how to THINK
558447077093408770,r/teenagers,serious-personal,55,Something which is vital to your life and is being lost
558447179375575042,r/teenagers,serious-personal,128,I'm so flabbergasted by the fact people are saying English and History is useless when it couldn't be any farther from the truth
558447394165882961,r/teenagers,serious-personal,73,Science_ Math_ History_ and English are the core of any form of education
558447418451034122,r/teenagers,serious-personal,10,Not really
558447461082071070,r/teenagers,serious-personal,77,English is reading_ but it's also learning how to write and argue effectively
558447493554372628,r/teenagers,serious-personal,30,And gain reading comprehension
558447558079414272,r/teenagers,serious-personal,97,You may have found Shakespeare useless_ but you learned how to dissect hard to understand writing
558447568300802048,r/teenagers,serious-personal,21,That is a vital skill
558447604304838678,r/teenagers,serious-personal,5,It is
558447614740267009,r/teenagers,serious-personal,26,Yet so many people lack it
558447688316878884,r/teenagers,serious-personal,1,^
558447777193918464,r/teenagers,serious-personal,120,My favorite books are the ones we read in school because we talked so much about the meanings we never would have gotten
558447802045300736,r/teenagers,serious-personal,36,Great Gatsby_ Scarlet Letter_ Anthem
558447931699626004,r/teenagers,serious-personal,47,Oh fuck Music is another major core of learning
558448000976814080,r/teenagers,serious-personal,77,my school it's mandatory to play an instrument from 4th grade until 8th grade
558448042743693314,r/teenagers,serious-personal,71,You can drop it then if you want_ but almost everyone continues with it
558448155838906370,r/teenagers,serious-personal,43,Anthem is very symbolic with light_ yes Zam
558448169093169172,r/teenagers,serious-personal,4,Yeah
558448192908296198,r/teenagers,serious-personal,36,3rd grade mandatory recorder lessons
558448235195269120,r/teenagers,serious-personal,44,4th grade you can go into band_ or orchestra
558448268107841547,r/teenagers,serious-personal,54,And chorus is mandatory from 5th grade until 7th grade
558448536950407178,r/teenagers,serious-personal,75,You can't be a citizen if you don't know history and you don't know english
558448627790381057,r/teenagers,serious-personal,75,I'm shit at reading computer code_ but I can at least sort of understand it
558448671243370506,r/teenagers,serious-personal,57,Computer Science was an option for a math credit at my HS
558448706698084355,r/teenagers,serious-personal,55,Most kids took it because they thought it would be easy
558448728483037194,r/teenagers,serious-personal,11,me included
558448815254798337,r/teenagers,serious-personal,27,Thats fucking retarded okay
558448960415727627,r/teenagers,serious-personal,50,idk_ I'm very classical in my education philosohpy
558449003339972609,r/teenagers,serious-personal,62,I don't like how school is becoming more and more of a daycare
558449113973260298,r/teenagers,serious-personal,55,Shakespeare is one of the greatest writers in the world
558449169430216715,r/teenagers,serious-personal,52,He has shaped how the english language works so much
558449202250907648,r/teenagers,serious-personal,59,You use words that SHAKESPEARE himself created almost daily
558449323621482538,r/teenagers,serious-personal,53,And they are useful for teaching ideas about concepts
558449377086275584,r/teenagers,serious-personal,63,The Tempest and Titus Andronicus are very useful teaching tools
558449589850472448,r/teenagers,serious-personal,43,It's to build an understanding of the world
558449647513894913,r/teenagers,serious-personal,97,Every class you take is to further your understanding of the world and make you an actual citizen
558449710415872020,r/teenagers,serious-personal,87,The old timey is the more relevant due to how much it shaped the world we live in today
558449793479737364,r/teenagers,serious-personal,82,Shakespeare is the second most quoted "thing" on Earth_ he's only behind the Bible
558449851940077568,r/teenagers,serious-personal,50,You cannot try to even argue how unimportant he is
558450009402507284,r/teenagers,serious-personal,163,And I'm anti-theist but I think we should take courses on religion and the bible and stuff so that we can understand them due to the influence they have on society
558450158921187341,r/teenagers,serious-personal,74,Broadening your perspectives should be and is mandatory_ at least in my hs
558450197919956992,r/teenagers,serious-personal,43,But you DONT KNOW what you want to do in HS
558450254555643934,r/teenagers,serious-personal,61,SO MANY PEOPLE switch their majors once they get into college
558450278425296896,r/teenagers,serious-personal,1,^
558450375670235156,r/teenagers,serious-personal,57,A lib arts education  should be mandatory for all schools
558450407987478528,r/teenagers,serious-personal,45,it actually creates a well rounded individual
558450585385304065,r/teenagers,serious-personal,123,You get to at least have an understanding of what you want to do by having all of these broad classes in high school though
558450673860083725,r/teenagers,serious-personal,140,A kid who wants to be a chemist will never know he wants to be a chemist_ maybe he wont even know he likes SCIENCE_ until he takes chemistry
558450771545554944,r/teenagers,serious-personal,56,I think the bible should be taught in literature classes
558450856299593738,r/teenagers,serious-personal,63,I think religion should be taught at a basic level for everyone
558451012914905089,r/teenagers,serious-personal,79,But you DONT attain a college level understanding unless you GO INTO THAT FIELD
558451086348910598,r/teenagers,serious-personal,91,I'm taking basic college history courses right now and these classes have taught me nothing
558451145069297684,r/teenagers,serious-personal,69,I've learned everything I've learned from basic 10th grade US History
558451247062056971,r/teenagers,serious-personal,34,You should still have anthropology
558451307481006082,r/teenagers,serious-personal,69,That's another thing people should actually be able to understand imo
558451444659781632,r/teenagers,serious-personal,122,I'd argue the American Education System is more modelled after the Liberal Arts Education of antiquity and the Renaissance
558451706476888064,r/teenagers,serious-personal,69,The liberal arts are vital to create a well rounded individual though
558451749271371778,r/teenagers,serious-personal,57,But I think music should be implemented into the lib arts
558451800072519680,r/teenagers,serious-personal,75,That's another vital aspect of life as it gives an artistic outlet for kids
558451840685965342,r/teenagers,serious-personal,36,Sciences are included under lib arts
558452028674670592,r/teenagers,serious-personal,186,If you have a school have mandatory tech classes you'll only breed technicians who hate themselves because they're unhappy_ this is why tech classes are not mandatory but are an elective
558452135734280193,r/teenagers,serious-personal,66,Well I mean tech is mandatory for one year in middle school for me
558452181951447045,r/teenagers,serious-personal,58,Woodshop and Engineering was mandatory in 8th grade for me
558452321340751877,r/teenagers,serious-personal,70,idk... I'm just sick of this generations aversion to actually learning
558452411589722122,r/teenagers,serious-personal,58,Literature classes are full of "You actually _read_ that?"
558452448164052992,r/teenagers,serious-personal,43,History classes are full of kids not caring
558452470091874315,r/teenagers,serious-personal,44,Science classes are full of kids goofing off
558452489817554985,r/teenagers,serious-personal,29,Math is full of kids sleeping
558452606846894099,r/teenagers,serious-personal,73,PE is normally the only class kids like because they dont have to "learn"
558452643719020554,r/teenagers,serious-personal,59,So I applaud the school for making working out fun for kids
558452979049431040,r/teenagers,serious-personal,65,Gym/PE was mandatory legit from Kindergarten until I graduated HS
558453017465061386,r/teenagers,serious-personal,2,Eh
558453031855718410,r/teenagers,serious-personal,20,My gym class kids do
558453044522647552,r/teenagers,serious-personal,16,1.5 mile warm up
558453069621493771,r/teenagers,serious-personal,44,20 minutes in the workout room doing weights
558453089774862347,r/teenagers,serious-personal,44,then the rest of the 80 minutes doing sports
558453173094973440,r/teenagers,serious-personal,65,Oh yeah also_ did you have 80 minute classes or 40 minute classes
558453198709325827,r/teenagers,serious-personal,51,Because 80 minute classes are actually a lot better
558453373293035540,r/teenagers,serious-personal,83,You don't get enough time to learn and dissect the information in 40 minute classes
558453407451447334,r/teenagers,serious-personal,14,Large classes?
558453412241604608,r/teenagers,serious-personal,6,In HS?
558453423247327273,r/teenagers,serious-personal,3,How
558453463953178625,r/teenagers,serious-personal,60,Largest class in my HS that wasnt in the lecture hall was 20
558453503442419712,r/teenagers,serious-personal,38,With the lecture hall it was almost 80
558453544076836885,r/teenagers,serious-personal,25,80 minutes was phenomonal
558453567329927168,r/teenagers,serious-personal,30,You got to dissect information
558453589106884636,r/teenagers,serious-personal,34,Also you had 2 days to do homework
558453625144213520,r/teenagers,serious-personal,52,Since you never had the same class two days in a row
558453639140737044,r/teenagers,serious-personal,18,Except for science
558453725820223488,r/teenagers,serious-personal,65,Science and Gym were on a schedule of Science-Sci-Gym-Sci-Sci-Gym
558453777158635520,r/teenagers,serious-personal,29,We have classes every day too
558453829071273995,r/teenagers,serious-personal,45,when I was still in HS it was 4 classes a day
558453870691352577,r/teenagers,serious-personal,18,You took 8 classes
558453889095958538,r/teenagers,serious-personal,24,But they were spread out
558453934717665290,r/teenagers,serious-personal,37,Math could be 2 or 3 days a week only
558453950794170378,r/teenagers,serious-personal,12,instead of 5
558454022017646613,r/teenagers,serious-personal,42,Gym could be 2 days a week or 1 day a week
558454366978441244,r/teenagers,serious-personal,31,https://i.imgur.com/1i1jrkO.png
558454383486959629,r/teenagers,serious-personal,31,That was my schedule 11th grade
558454402520842240,r/teenagers,serious-personal,24,Just missing PE and Math
558454518400942080,r/teenagers,serious-personal,31,https://i.imgur.com/lyOem5G.png
558454535706771476,r/teenagers,serious-personal,23,Likewise for 12th grade
558454554165772299,r/teenagers,serious-personal,10,Missing PE
558454588236103680,r/teenagers,serious-personal,61,I took a study hall instead of anotehr elective in 12th grade
558454614479863809,r/teenagers,serious-personal,16,It's interesting
558454666833428501,r/teenagers,serious-personal,25,Taught me to manage money
558454699477565452,r/teenagers,serious-personal,33,Made me understand how taxes work
558454727700906004,r/teenagers,serious-personal,27,How the national debt works
558454781316694016,r/teenagers,serious-personal,37,PiG is Participation in Goverment btw
558454855878967306,r/teenagers,serious-personal,83,so we learned how global gov works_ how national gov works_ and how local gov works
558454955367727115,r/teenagers,serious-personal,82,we took a field trip to DC to see the senate building and got to meet people there
558455004109864970,r/teenagers,serious-personal,55,Those are 2 classes that should be mandatory everywhere
