ID,Server,Channel,Content Length,Content
558455029862891520,r/teenagers,serious-personal,12,PiG and Econ
558455097521209345,r/teenagers,serious-personal,32,12th yes_ 11th was the other one
558455246591098892,r/teenagers,serious-personal,31,https://i.imgur.com/9boSntL.png
558455272293793803,r/teenagers,serious-personal,35,Now you look at my college schedule
558455292669722656,r/teenagers,serious-personal,42,and it's not even close to as well rounded
558455322524778497,r/teenagers,serious-personal,43,And it's so much worse than my HS education
558455346251825152,r/teenagers,serious-personal,27,Classes are only 50 minutes
558455371199414287,r/teenagers,serious-personal,18,its legit horrible
558455440783048705,r/teenagers,serious-personal,24,Lib arts college in Mass
558455475327336459,r/teenagers,serious-personal,31,https://i.imgur.com/HDqcmfF.png
558455500933562408,r/teenagers,serious-personal,35,This was my first semester schedule
558455595003543562,r/teenagers,serious-personal,22,Still utterly horrible
558455898914291732,r/teenagers,serious-personal,119,Only interesting class of first semester was my writing class because you can always learn new stuff in writing classes
558455942560219136,r/teenagers,serious-personal,74,The history and gov classes were just rehashing everything i learned in hs
558456084457717760,r/teenagers,serious-personal,227,second semester the only good class is theatre and lit because I never took a theatre class before and the history and how theatre works is really fun to learn about_ and lit because I love reading and dissecting literary works
558456118804742165,r/teenagers,serious-personal,29,I'm biased for reading though
558456179353845770,r/teenagers,serious-personal,96,My dad used to force me and my siblings to read books over summer and write book reports for him
558456205354205198,r/teenagers,serious-personal,36,If we didn't do them we got grounded
558456314104381450,r/teenagers,serious-personal,92,Summer going into 12th grade I read Don Quixote and wrote like a 10 page report on that book
558456340188758036,r/teenagers,serious-personal,23,Such a good book though
558456434841354261,r/teenagers,serious-personal,102,My sister read Little Women_ my brother read Huck Fin since he was only in 7th grade (he got off easy)
558456436842037269,r/teenagers,serious-personal,3,yes
558456551782875146,r/teenagers,serious-personal,59,I read Moby Dick for my summer going into 9th grade I tihnk
558456651909431300,r/teenagers,serious-personal,73,Les Mis was def summer going into 10th grade_ I remember that one vividly
558456671962136576,r/teenagers,serious-personal,39,Tale of Two Cities is all I like by him
558456787616006149,r/teenagers,serious-personal,58,Hemingway_ Steinbeck_ and Bradbury are my favorite authors
558456839877165056,r/teenagers,serious-personal,42,Les Mis is amazing but its a long ass read
558456853139554304,r/teenagers,serious-personal,18,over 1k pages long
558456875646058506,r/teenagers,serious-personal,8,yes I do
558456917115142155,r/teenagers,serious-personal,51,East of Eadon is still my fav Steinbeck book though
558457028276650004,r/teenagers,serious-personal,41,Gone with the Wind is a good book as well
558457133142900774,r/teenagers,serious-personal,46,The Scarlet Letter is actually really good imo
558457209650937858,r/teenagers,serious-personal,57,The Martian _CHRONICLES_ is one of my favorite books ever
558457254618071043,r/teenagers,serious-personal,45,Its a collection of short stories by Bradbury
558457322431709186,r/teenagers,serious-personal,54,The Picture of Dorian Grey is another really good book
558457339171307543,r/teenagers,serious-personal,29,I forget when I read that one
558457390312194055,r/teenagers,serious-personal,33,I actually don't mind that series
558457446750879754,r/teenagers,serious-personal,7,Really?
558457449150152716,r/teenagers,serious-personal,4,damn
558457464107040770,r/teenagers,serious-personal,17,Thats alien to me
558457543123271681,r/teenagers,serious-personal,4,1984
558457567026610186,r/teenagers,serious-personal,8,Jan Eyre
558457597057826817,r/teenagers,serious-personal,17,Wuthering Heights
558457653744107533,r/teenagers,serious-personal,38,Dracula is actually a really good read
558457677743915019,r/teenagers,serious-personal,15,Brave New World
558457717346271273,r/teenagers,serious-personal,15,Grapes of Wrath
558457792701267968,r/teenagers,serious-personal,36,I don't read a lot of contemporaries
558457853740843014,r/teenagers,serious-personal,59,I read the shit out of the Warriors series in middle school
558457919314591762,r/teenagers,serious-personal,66,Septimus Heap series was amazing_ I read that in elementary school
558457964147638272,r/teenagers,serious-personal,52,I actually didn't mind the Twilight Series that much
558458102316269624,r/teenagers,serious-personal,68,Read the first three books the summer I was going into middle school
558458138874085380,r/teenagers,serious-personal,50,Fell in love with that series_ devoured every book
558458295657168918,r/teenagers,serious-personal,90,Septimus Heap_ Warriors_ Leviathan_ and Incarceron are the series that shaped my childhood
558458310416793630,r/teenagers,serious-personal,12,No_ Septimus
558458472635695124,r/teenagers,serious-personal,64,Leviathan actually was the trilogy that got me into Euro history
558458513702125578,r/teenagers,serious-personal,33,its an alt history trilogy of WWI
558458681272958997,r/teenagers,serious-personal,55,Oh another old book that I loved_ The Neverending Story
558458724726079509,r/teenagers,serious-personal,35,Wizard of Oz was also a decent book
558458734180040704,r/teenagers,serious-personal,5,Weird
558458742090366996,r/teenagers,serious-personal,8,but good
558459016704163851,r/teenagers,serious-personal,44,A Clockwork Orange is another weird ass book
558459092306362390,r/teenagers,serious-personal,12,JULES VERNE!
558459117111607316,r/teenagers,serious-personal,45,Read the shit out of him in elementary school
558459418681802783,r/teenagers,serious-personal,63,Agatha Christie is really the closest to contemporary I get btw
558459488756039700,r/teenagers,serious-personal,42,I've read basically everything she's wrote
558459635062013964,r/teenagers,serious-personal,47,Paradise Lost is one of the oldest books I read
558459654724780032,r/teenagers,serious-personal,20,OH FUCK JOHN GRISHAM
558459660277907496,r/teenagers,serious-personal,10,I love him
558459666485608470,r/teenagers,serious-personal,9,Nevermind
558459692175851532,r/teenagers,serious-personal,33,he's the most contemporary I read
558459704934793217,r/teenagers,serious-personal,13,because he is
558459796970405927,r/teenagers,serious-personal,70,White Fang_ that was the first book my dad made me do a book report on
558459831967547408,r/teenagers,serious-personal,42,Read that in the summer going to 7th grade
558460218728644608,r/teenagers,serious-personal,41,I like Ayn Rand's work as well personally
558460264065007658,r/teenagers,serious-personal,68,I'm aware Atlas Shrugged is considered horrible by literary scholars
558460275406405634,r/teenagers,serious-personal,25,but idc_ i love that book
558460420206231578,r/teenagers,serious-personal,27,Read up on her "philosophy"
558460501185527818,r/teenagers,serious-personal,91,in quotations because most philosophers balk at the idea of calling her ideals a philosophy
558460579874996235,r/teenagers,serious-personal,22,I follow it personally
558460645402738709,r/teenagers,serious-personal,56,But I'm aware its something I'll most likely grow out of
558460705150337036,r/teenagers,serious-personal,45,She gains a lot of her followers in teenagers
558460771164749824,r/teenagers,serious-personal,36,look up Objectivism (Rand) on google
558460823534698506,r/teenagers,serious-personal,57,It's an interesting read_ I think it makes a lot of sense
558460945471635456,r/teenagers,serious-personal,79,My beliefs are the bastardization of Ayn Rand_ George Carlin_ and Thomas Hobbes
558461181325606921,r/teenagers,serious-personal,50,Would you say those three combined equal nihilism?
558461326423359489,r/teenagers,serious-personal,39,It's not like I have Nietzsche in there
558462324118257664,r/teenagers,serious-personal,18,Retrace your steps
558462368603045888,r/teenagers,serious-personal,76,It didn't grow legs and move_ but someone with legs could very easily moveit
558462858610999312,r/teenagers,serious-personal,2,No
558462866873778177,r/teenagers,serious-personal,12,Give it time
558462888658993162,r/teenagers,serious-personal,25,Even if time doesn't work
558462906380058627,r/teenagers,serious-personal,38,Some people process things differently
558463015591346196,r/teenagers,serious-personal,5,Clubs
558463158822502430,r/teenagers,serious-personal,60,Clubs_ join drama_ do sports_ do anything that isn't discord
558463222500294676,r/teenagers,serious-personal,43,I find Wrestling creates the best community
558463313839783937,r/teenagers,serious-personal,99,Because you're all starving and pissed at the coach and angry and it creates a wonderful envronment
558463414070935552,r/teenagers,serious-personal,52,obv not for you lol_ was saying in response to track
558463446480453633,r/teenagers,serious-personal,38,I did wrestling so thats my experience
558464092285829120,r/teenagers,serious-personal,114,I'd rationalize it this way_ he lived to a really old age and thats something that not a lot of people can achieve
558464105535766528,r/teenagers,serious-personal,27,He lived a long_ happy life
558464208732291083,r/teenagers,serious-personal,64,There's nothing more you can do except keep him in your memories
558464471908089886,r/teenagers,serious-personal,11,You just go
558464523586240532,r/teenagers,serious-personal,31,Death is a natural part of life
558466490446381077,r/teenagers,homework,47,Prof wants a 3 page critique of play we watched
558466564802871328,r/teenagers,homework,113,it was so bad and so see through in terms of message that this paper is now 5 pages long and just full of insults
558466608150872064,r/teenagers,homework,43,I don't know how to give her what she wants
558467374093828107,r/teenagers,self,12,I see it too
558468186681376786,r/teenagers,serious-personal,150,So I just found out that my old friend group thought I was gay until I got with my gf_ and they still think I'm gay and I just got with her as a cover
558468195170910209,r/teenagers,serious-personal,5,_fun_
558468623438446592,r/teenagers,serious-personal,61,Because apparently giving a shit about how you look = you gay
558468663208968193,r/teenagers,serious-personal,58,Also the fact I have more female friends than male friensd
558468778225303562,r/teenagers,serious-personal,105,Like I'm sorry I always make sure my hair is done well and that I wear button up shirts and leather shoes
558468791026319360,r/teenagers,serious-personal,28,But that doesn't make me gay
558469184263290885,r/teenagers,serious-personal,130,It doesn't bother me that much but I just hate the connotation of dressing well/having more female friends than male friends = gay
558469253548998660,r/teenagers,serious-personal,54,I don't like streetwear dammit_ I like business casual
558469386336469001,r/teenagers,serious-personal,45,I really only have my GF and my family rn lol
558469399795990558,r/teenagers,serious-personal,28,That friend group dropped me
558469436554608640,r/teenagers,serious-personal,50,My sister has always been my closest friend though
558469601868906508,r/teenagers,serious-personal,166,I trust my sister more than I trust my own gf rn_ but thats just because I can't trust someone as much as I trust my sister when we've only been together for 6 months
558469723805712389,r/teenagers,serious-personal,38,I also just dont give out trust easily
558469743447900161,r/teenagers,serious-personal,26,I really only trust family
558469834313039872,r/teenagers,serious-personal,77,It took me until we were in 5 months in until I told my gf that I trusted her
558469864751235073,r/teenagers,serious-personal,37,And I still don't trust her fully lol
558469982753914895,r/teenagers,serious-personal,112,I know my mom asked my dad when they were together for a year if he trusted her and he straight up said "no" lol
558470632778760202,r/teenagers,serious-general,15,Star Wars is eh
558470711275159563,r/teenagers,serious-general,76,People either like one of the big three: Star Wars_ Star Trek_ or Doctor Who
558470718338236426,r/teenagers,serious-general,6,I'm DW
558470903881531433,r/teenagers,serious-general,41,Ewan McGregor only good part of Star Wars
558470915722313749,r/teenagers,serious-general,23,that man is hot as hell
558470955131863040,r/teenagers,serious-general,35,4th Doctor is still the best doctor
558471256211587102,r/teenagers,serious-general,43,11 = 8 > 10 = 4 > 12 =3 > 9 > 2 > 5 > 1 > 7
558471318123839489,r/teenagers,serious-general,69,I've seen the whole series and listened to all the audio dramas for 8
558471403255365652,r/teenagers,serious-general,17,The movie is okay
558471435400511509,r/teenagers,serious-general,36,His short for the special is amazing
558471465020948480,r/teenagers,serious-general,43,and his audio dramas are fucking phenomonal
558471533626916886,r/teenagers,serious-general,72,If he had his own series then 8 would be my favorite doctor of fall time
558808841689497610,r/teenagers,general,29,I still need to get my permit
558808847129509899,r/teenagers,general,3,;-;
558809027111288872,r/teenagers,general,14,Yeah I'm aware
558809151762071555,r/teenagers,general,68,I need to get my license if I want to get this job my dad can get me
558809187728097300,r/teenagers,general,33,would be 9-5 over the summer time
558809229163626516,r/teenagers,general,64,But I need my license because I'd be working at a car dealership
558809327498952717,r/teenagers,general,16,I want a 9-5 job
558809357853130763,r/teenagers,general,50,I hate summers because there is too much free time
558809437352230932,r/teenagers,general,63,So if I get this summer job_ I'd have a 9-5 job 5/6 days a week
558809470419861535,r/teenagers,general,24,And min wage is like $10
558809485078953984,r/teenagers,general,2,18
558809551869050901,r/teenagers,general,4,Yeah
558809571871686687,r/teenagers,general,21,I don't want to drive
558809662451875870,r/teenagers,general,2,Eh
558809703233093645,r/teenagers,general,49,I just dont wanna do the 5 hour drivers ed course
558809847424876595,r/teenagers,general,100,And besides_ I might be transferring to a college that's in Buffalo so I wouldn't even have to drive
558809914802438145,r/teenagers,general,33,Yeah I dont have my permit either
558809965540802570,r/teenagers,general,80,My plan is just to move to Boston or NYC or someplace with good public transport
558810049493991434,r/teenagers,general,54,I have yet to have a regret that I dont have my permit
558810084927602693,r/teenagers,general,58,My GF is almost 20 and she doesnt even have her permit lol
558823345676877854,r/teenagers,music,43,https://www.youtube.com/watch?v=-jufs-ChS3I
558830842680705054,r/teenagers,general,17,I hate love songs
558830924293341186,r/teenagers,general,35,Except for like_ one Fratellis song
558831153402871808,r/teenagers,general,14,its super busy
558831176530526228,r/teenagers,general,34,This is the busiest discord I'm on
558831217571790876,r/teenagers,general,63,The only other servers are legit just league champ main servers
558846833724751876,r/teenagers,self,28,I need to learn how to smile
560644129810284544,r/teenagers,serious-personal,46,Hey so I just fully threatened to kill someone
560644191022219284,r/teenagers,serious-personal,87,Is it possible to admit myself to ER for mental reasons because I feel unsafe right now
560644305442832404,r/teenagers,serious-personal,15,I did tell them
560644309872017438,r/teenagers,serious-personal,4,well
560644319120457735,r/teenagers,serious-personal,20,more along the lines
