ID,Server,Channel,Content Length,Content
558469104831299584,FlareTV - PewDiePie vs T-Series,pewdiepie-vs-tseries,20,guys i am really sad
558469200218161153,FlareTV - PewDiePie vs T-Series,pewdiepie-vs-tseries,29,is pewdiepie back in the lead
558469334796861442,FlareTV - PewDiePie vs T-Series,pewdiepie-vs-tseries,11,i am ok now
558469404233302016,FlareTV - PewDiePie vs T-Series,pewdiepie-vs-tseries,52,i  checked a while ago and t series was ahead by 11k
558469500576596031,FlareTV - PewDiePie vs T-Series,pewdiepie-vs-tseries,42,good to know there's justice in this world
