ID,Server,Channel,Content Length,Content
558870777336692746,Official Fortnite,fortnite-general,24,anyone wnts to one v one
558871098154942464,Official Fortnite,lfg-battleroyale-console,24,anyone wnts to one v one
558871426472607744,Official Fortnite,lfg-battleroyale-console,32,anyone wnts to one v one NA-east
558872077319536658,Official Fortnite,lfg-battleroyale-console,52,anyone wnts to one v one NA-east im so fucking bored
558872295280476163,Official Fortnite,lfg-battleroyale-mobile,2,me
558872344953880596,Official Fortnite,lfg-battleroyale-mobile,12,u on NA-east
