ID,Server,Channel,Content Length,Content
560644384647938048,Official Fortnite,fortnite-general,62,ｙｏ  ｇｕｙｓ ｉ ｃａｎ ｏｎｌｙ ｒｕｎ ｆｏｒｔｎｉｔｅ ａｔ ４０ ＦＰＳ ａｎｙ ｔｉｐｓ ｔｏ ｉｍｐｒｏｖｅ
560644499219546127,Official Fortnite,fortnite-general,3,ｙｅａ
560644569696305153,Official Fortnite,fortnite-general,35,ｂｕｔ ｍｙ ｐｈｏｎｅ ｉｓ ａｌｓｏ ｖｅｒｙ ｌａｇｇｙ ｔｈｏ
560644639594512385,Official Fortnite,fortnite-general,46,ａｎｄ ｍｙ ｌａｐｔｏｐ  ｒｕｎｓ ｏｎａ ｉｎｔｅｌ ｉ７ ｐｒｏｃｅｓｓｏｒ ｔｏｏ
560644734666932234,Official Fortnite,fortnite-general,42,ｗｈｏ ｉｓ ｄｅｌｅｔｉｎｇ ｍｙ ｍｅｓｓａｇｅｓ ｓｔｏｐ ｉｔ ａｄｍｉｎｓ
