ID,Content Length,Content
558838317748060166,10,which show
558838435104686080,6,beast?
558838504902098979,13,beast player?
558838582874341396,17,ah_ its on my ptw
558838610208751637,21,should i expedite it?
558838830648524800,50,im really just watching a lot of romance right now
558838843575369728,9,and drama
558838897107402762,29,i dont think this will fit in
558838953890021376,54,but i do want a short break from purely romance dramas
558839036828188690,47,after i finish fruits basket and lovely complex
558839283612516352,18,how does it watch>
558839371311087616,63,is it slow progression or like a lot of information to take in?
558840735693275136,19,weird ass anime art
