ID,Server,Channel,Content Length,Content
558443922754371605,Official Fortnite,fortnite-general,48,Renegade is a season 1 skin from the season shop
558444381254975498,Official Fortnite,fortnite-general,102,<@150678186810671104> it was a mistake too epic is making a style for the original buyers for the skin
558445783205281797,Official Fortnite,fortnite-general,19,What's the mistake?
558446027171037220,Official Fortnite,fortnite-general,48,The community is all over "og" stuff it's insane
558461536029376513,Official Fortnite,stw-questions,152,The mission for 100vbucks saying complete 8 ssd can that be completed by doing other people's ssd? Instead of your own? @ me if you have a answer for me
558755949100138521,MINECRAFT,multiplayer,46,hello_ I have bedrock and java _ dm me to play
558756494653521930,MINECRAFT,multiplayer,46,hello_ I have bedrock and java _ dm me to play
558757001472245806,MINECRAFT,multiplayer,46,hello_ I have bedrock and java _ dm me to play
558803155991789582,MINECRAFT,multiplayer,89,hello_ i have a nation_ on a server _ would anyone like to be w/ me ?? dm me if u want to
558807929294159898,MINECRAFT,multiplayer,96,hello_ i need a girl to play w/me on my nation_ (java) i need someone please please please dm me
558808440026431488,MINECRAFT,multiplayer,96,hello_ i need a girl to play w/me on my nation_ (java) i need someone please please please dm me
558808946459279360,MINECRAFT,multiplayer,105,hello_ i want someone to play w/me on my nation in a java server_ please dm me (i really want a girl btw)
558809469900029971,MINECRAFT,multiplayer,105,hello_ i want someone to play w/me on my nation in a java server_ please dm me (i really want a girl btw)
558812124000944163,MINECRAFT,multiplayer,104,hello_ i want someone to join me and my nation on a java server. please dm me (and a girl would be nice)
558812882888818714,MINECRAFT,multiplayer,104,hello_ i want someone to join me and my nation on a java server. please dm me (and a girl would be nice)
558814563357687834,MINECRAFT,multiplayer,70,hello_ i want someone to join my nation on a java server_ please dm me
558815343657877544,MINECRAFT,multiplayer,70,hello_ i want someone to join my nation on a java server_ please dm me
558817932009013249,MINECRAFT,multiplayer,139,ohk_ look i know for a fact no girls are going to dm me when i say this. but i want a girl to join my nation in a java server. please dm me
558818474303160320,MINECRAFT,multiplayer,139,ohk_ look i know for a fact no girls are going to dm me when i say this. but i want a girl to join my nation in a java server. please dm me
558818983663501319,MINECRAFT,multiplayer,130,hey_ can someone join me in a java sever ??  i just want someone to help me in my nation. i would be very happy if u dm me. (1.12)
558819522250014730,MINECRAFT,multiplayer,130,hey_ can someone join me in a java sever ??  i just want someone to help me in my nation. i would be very happy if u dm me. (1.12)
558820087457513497,MINECRAFT,multiplayer,130,hey_ can someone join me in a java sever ??  i just want someone to help me in my nation. i would be very happy if u dm me. (1.12)
558820823767449601,MINECRAFT,multiplayer,130,hey_ can someone join me in a java sever ??  i just want someone to help me in my nation. i would be very happy if u dm me. (1.12)
558821347812442114,MINECRAFT,multiplayer,130,hey_ can someone join me in a java sever ??  i just want someone to help me in my nation. i would be very happy if u dm me. (1.12)
558821924705402880,MINECRAFT,multiplayer,130,hey_ can someone join me in a java sever ??  i just want someone to help me in my nation. i would be very happy if u dm me. (1.12)
558822526109876244,MINECRAFT,multiplayer,130,hey_ can someone join me in a java sever ??  i just want someone to help me in my nation. i would be very happy if u dm me. (1.12)
558823077916442655,MINECRAFT,multiplayer,76,hello_ would anyone want to join a java server (1.12) dm me if u want to !!!
558870277740691487,MINECRAFT,multiplayer,87,hello_ looking for someone to play w/me on my nation_ in a java server_ dm me too play.
559021386639605780,MINECRAFT,multiplayer,166,Hello_ I'm looking for someone to play with me in a java server on my nation_ please DM me if u want to play. (I would be grateful) thank you u have a nice day.(1.12)
559022790200655872,MINECRAFT,multiplayer,166,Hello_ I'm looking for someone to play with me in a java server on my nation_ please DM me if u want to play. (I would be grateful) thank you u have a nice day.(1.12)
559109553485119489,MINECRAFT,multiplayer,66,hello_ would anyone like to join  java server 1.13.2 please dm me_
559110208354254858,MINECRAFT,multiplayer,65,hello_ would anyone like to join  java server 1.13.2 please dm me
559110870496706611,MINECRAFT,multiplayer,187,Hello_ everyone I hope u guys are having a great day !!! Would anyone like to join a java server(1.13.2) we have a town where u get to trade and live !!! please dm me if u want to join !!
559111595029168209,MINECRAFT,multiplayer,187,Hello_ everyone I hope u guys are having a great day !!! Would anyone like to join a java server(1.13.2) we have a town where u get to trade and live !!! please dm me if u want to join !!
560286575150235659,FlareTV - PewDiePie vs T-Series,general,14,China number 1
560286883326853122,FlareTV - PewDiePie vs T-Series,general,20,Whare r u guys from?
560286977342308353,FlareTV - PewDiePie vs T-Series,general,12,Im Indonesia
560287003627749409,FlareTV - PewDiePie vs T-Series,general,19,Nice to meet u guys
560287071428673566,FlareTV - PewDiePie vs T-Series,general,29,This is america that's canada
560287176261238834,FlareTV - PewDiePie vs T-Series,general,6,Me too
560287242774380546,FlareTV - PewDiePie vs T-Series,general,36,Pewdipie can speak english correctly
560287276660424704,FlareTV - PewDiePie vs T-Series,general,34,I tough pewdipie is english people
560287354921811969,FlareTV - PewDiePie vs T-Series,general,27,<@531792911533080596> haloo
560287381631139853,FlareTV - PewDiePie vs T-Series,general,5,Yeahh
560287481996509187,FlareTV - PewDiePie vs T-Series,general,36,When pewds an t series ends the war?
560287637424832534,FlareTV - PewDiePie vs T-Series,general,4,Okay
560287725949812736,FlareTV - PewDiePie vs T-Series,general,41,Takes a long time to finish it in 100 mil
560287760741564429,FlareTV - PewDiePie vs T-Series,general,16,Month an a month
560287970402500620,FlareTV - PewDiePie vs T-Series,general,14,Im still child
560288096738869249,FlareTV - PewDiePie vs T-Series,general,8,Who? Me?
560288203882364948,FlareTV - PewDiePie vs T-Series,general,28,My friends always doing meme
560288225927626753,FlareTV - PewDiePie vs T-Series,general,27,Im so cringe to look at him
560288377564299309,FlareTV - PewDiePie vs T-Series,general,41,I don't understand meme out of my country
560288409092882472,FlareTV - PewDiePie vs T-Series,general,25,<:Wut:519226309059149833>
560288481788690443,FlareTV - PewDiePie vs T-Series,general,23,This sticker looks dope
560288520972009472,FlareTV - PewDiePie vs T-Series,general,27,<:jesus:556100529307254784>
560608006828458010,MINECRAFT,multiplayer,231,Hello everyone and good evening !!!!_ Would you like to join a Minecraft server ??  If you would please DM me _ but u must but over ther age of 16_ and have a  working mic. This is a 1.13 java server. Please DM me if u want to join
560608920759173140,MINECRAFT,multiplayer,261,Hello everyone and good evening !!!!_ Would you like to join a Minecraft server ??  If you would please DM me _ but u must but over the age of 16_ and have a  working mic. This is a 1.13 java server. Please DM me if u want to join. Thank you_ have a good day !!
560609526756409403,MINECRAFT,multiplayer,261,Hello everyone and good evening !!!!_ Would you like to join a Minecraft server ??  If you would please DM me _ but u must but over the age of 16_ and have a  working mic. This is a 1.13 java server. Please DM me if u want to join. Thank you_ have a good day !!
