ID,Server,Channel,Content Length,Content
560627825476894730,MINECRAFT,minecraft,5,What?
560627855407710210,MINECRAFT,minecraft,37,How DAre Yee It's Always Bee RElevent
560627924949139467,MINECRAFT,minecraft,58,**I've Been Playing MC For 8 Years Straight How Dare Yee**
560628176439607317,MINECRAFT,minecraft,77,Lol ALways Been Feeling Weird Playing MC Cause Everyone Made Fun Of Me For It
560628382631591957,MINECRAFT,skins-n-textures,73,Make The Pixels Nothing_ And Put The Picture In PNG. I Think That's Right
