ID,Content Length,Content
558802680181555204,31,ehm_ who even has a life here 👀
558803463253786631,72,ruckus isnt even a nice skin_ a rare skin is like_ over 200 days or smth
558804234045227020,109,bruv_ do you know how many ppl played back then? its not ur rare skin_ who cares about ur *OG* skins_ nobody.
558805024604553234,153,wow cool_ you have  skins and friends who can get you cosmetics that you can flex with_ wow_ im so jealous. also_ why would you waste money on tiers lol.
558807467254087700,130,Eh? in what way am i jealous? that he has virtual money? I dont care about skins etc. When did i insult him? <@340611135281561611>
558808951693639680,78,<@340611135281561611> Ehm_ neither did you have to comment the situation_ lol.
