ID,Content Length,Content
558861781968224256,60,<@300670483668402177> I can't get measles_ i am vaccinated ğŸ˜
558862077855531043,50,He is stealing my baby_ help <@499464292580458496>
558862312958591003,49,I have absolutely no idea about what he is saying
558862985016377365,14,Yuck_ raw fish
558863124632043521,54,Yo_ that fish is saw raw that_ it is still laying eggs
559045231769812995,157,I am really sorry that i got a couple of people banned from using Dank Memer bot_they asked me money and i kindly shared_never knew they would ban them too ğŸ˜¢
