ID,Server,Channel,Content Length,Content
558754908543909913,Official Fortnite,fortnite-general,20,Yes it's not Tfue ;0
558755000310956052,Official Fortnite,fortnite-general,31,If will get your grandma banned
558755308152029205,Official Fortnite,fortnite-general,25,Fine miss out I dont care
558789167958458390,Official Fortnite,lfg-battleroyale-pc,51,Looking for a good squad i just need a first win EU
558798508488917044,Official Fortnite,lfg-battleroyale-pc,51,Looking for a good squad because i need a first win
558844226423488542,Official Fortnite,battleroyale-images,46,When you have aimbot and you see a china  noob
