ID,Content Length,Content
560652630745939978,34,This is the worst update ever lmao
560653182204903445,283,Lmaoooo <@517457256858648576> <@!546330545500454913> y’all just could not take the sweat. When you got regens from kills people actually were aggressive. They actually played the damn game. Now all you get is a bunch of scared fools in little 1x1s all over the map. And it’s retarded
560653628856205312,53,Did I say “ me “ or “ people “ <@!546330545500454913>
560653832082817039,66,Bruh your managing that aspect of the debate better then ever will
560654055752597544,82,My first game in 2 weeks I get 10+ kills cause everyone is just scared and camping
560654189597032459,58,Lmao and your the cocksucker who takes any $hit your given
560654391640719374,43,Ok ?  I don’t have a need to so why would i
560654697011216385,115,No. That’s my opinion. I think this update is bullshit. If ur fine with it idgaf. Stop trying to change my mind tho
