ID,Server,Channel,Content Length,Content
558990352498032651,/r/Anime Discord!,anime,99,But when will we get adaptations of the good Isekai like Pizza Parlor Isekai and Prostitute Isekai?
558992311611162624,/r/Anime Discord!,anime,70,At first I thought that was Jumpforce Related and got excited for Hiei
558992379722334240,/r/Anime Discord!,anime,25,That must be from Pierrot
558992417328594945,/r/Anime Discord!,anime,41,Because those are all shows done by them.
558992830207361024,/r/Anime Discord!,anime,46,Imagine choosing Hitsugaya to represent Bleach
558992859336802315,/r/Anime Discord!,anime,18,Irrelevant as hell
558992901720375306,/r/Anime Discord!,anime,30,That is a correct opinion Asme
558993059602366466,/r/Anime Discord!,anime,67,I'd rather have classy casual clothes Aizen or Byakuya or Kenpachi.
