ID,Channel,Content Length,Content
560984493415071755,skins-n-textures,27,What skin does everyone use
560985132727664653,skins-n-textures,37,I need to make my own but idk how yet
560985287753203713,skins-n-textures,17,I'm on a phone XD
560985506700197915,skins-n-textures,78,My fingers mess my stuff up so I use pre made skins til my bf gets our laptops
560990700330549251,skins-n-textures,43,There's a dragon one in the Minecraft store
560990747231387659,skins-n-textures,32,U can find Kool castles in there
560990809126600715,skins-n-textures,25,I only have 110 minecoins
