ID,Content Length,Content
558787813345067019,9,stay woke
558788033835696128,62,ya but people are attracted to traps because they have a penis
558788042094149632,18,which makes it gay
558788099119775746,9,yes it is
558788141662732299,10,no it isnt
558788174378303498,56,otherwise it would be you are attracted to a normal girl
558788177243013132,7,exactly
558788189679255554,3,no?
558788193085030410,7,it isnt
558788251364753409,74,ik people with trap fetishes and its just a glorified crossdressing fetish
558788280691326987,5,what?
558788396856639512,3,yes
558788445711892505,30,because they are not masculine
558788470202433547,47,its the same way women arent attracted to neeks
558788527727312906,3,wot
558788665698942991,9,no im not
558788679255195668,36,but youre talking in generalizations
558788697684967434,36,so i will respond in generalizations
558788751334178836,57,i mean who gives a shit if u like traps just know its gay
558788855994646531,10,no it isnt
558788868871290921,3,yes
558788875602886681,12,the gay part
558788928388333588,22,not the trans part tho
558789153903345695,29,they didnt originate in anime
558789158362152991,3,lel
558789201303437312,21,its like thai faggots
558789239765204997,33,its common allover southeast asia
558789256592621579,20,irl traps_ im saying
558789286221316135,22,its not an anime thing
558789340063596545,28,they arent consensually tran
558789346036023346,5,trans
558789378663645214,82,a lot of them are kidnapped as boys and fed hormones to be prostituted in the city
558789764535418890,297,<@346090620881862658> one of my close mates is a thai prince or whatever whos parents are in politics he was telling me about it. i cant find anything on english language sources on my school wifi (its very censored)_ i can ask him if he can give me something tomorrow morning translated from thai
558790870183444530,21,lets get a deb8 going
558791014379421696,22,then leave the channel
558791385520537603,2,no
558791399982628884,18,no races mentioned
558791735388667919,2,ok
558791753982017585,42,can we get something actually going please
558792020383105044,46,and all of those people are inherently racist?
558792315288944661,31,wait laci green went right wing
558792324566745099,19,when did this hapen
558792391470088214,29,ok this is a pointless debate
558792529349443595,88,apparently she started dating some right wing guy and then did an ideological about-face
558792545006518293,22,according to this post
558792577093074969,31,racially insensitive =/= racist
558792745792045092,32,okay can we get an actual debate
558792844253462547,63,<@!325983451331166208> you realize the sub you linked is satire
558792885135212544,80,as in_ the posts they make are laughing at people who actually believe hat stuff
558793005381976064,2,ok
558793019185299464,13,change topics
558793361444569101,88,abortions a debate where there will never be compromise and it always takes like 4 hours
558793911724670988,217,abortions should be easily available and shouldn't be bannedNLhowever late term abortions should be bad_ and abortions should only be legal under certain circumstances; i.e rape_ incest_ if it threatens the mother/baby
558794361450528768,103,the morality of the debate is one that is hard to reach compromise on because its effectively two sides
558794395705671689,58,does birth confer life or conception/gestation confer life
558794449363402752,57,whichever side you choose will dictate the morality of it
558795339767873552,40,i think azul raises a fair point on that
558795407195504640,77,i do still disagree_ personally I think the potential of life makes it amoral
558795490100248576,50,it is overdone because it’s a very either or topic
558795648426573836,51,but you can educate them on proper contraception if
558795709630119941,49,that was the gayest way to phrase that niquel lol
558796173641515008,46,why do you need to say that three times niquel
558796177362124800,39,contraception =\= stopping from banging
558797430485942302,78,my mum gives me condoms if I ask which is low key fucking odd but epic style 😎
558797566616010752,44,we should get a more productive debate going
558797776750903316,56,yes_ because if you want to die you are not worth living
558797833705226242,7,not rly
558798180939071500,1,^
558798202514440192,87,as long as it is a genuine will to die not temporary mental instability they should die
558798537949708306,1,^
558798694233931786,39,i don’t believe in 100% bodily autonomy
558798754812264485,58,the same way there shouldn’t be 100% intellectual autonomy
558799174628540430,32,What precedent is that Cthulhuwu
558799317155184670,3,yes
558799325074030607,10,You do not
558799431567409164,57,No_ because their problems will likely be fixed with time
558799772761194516,62,That’s an extreme scenario and basically a straw man Cthulhuwu
558799942794346506,61,But public euthanasia isn’t entirely removing bodily autonomy
558799977057615882,37,Youre making it an either or scenario
558799984120561675,11,No it isn’t
558800008598781963,11,No it isn’t
558800137464446987,58,Suicide was illegal in the 50s lmao what are u even saying
558800166207881240,34,Unless ur in some shithole country
558800405887451146,20,What country is that
558800440104321046,12,No it is not
558800937276145664,64,You are intentionally misrepresenting that information Cthulhuwu
558801027952803861,106,This is the table Cthulhuwu is referencing_ suicide is legal_ euthanasia/assisted suicide depends on state
558801092348215319,35,You did not specify that originally
558801119090835457,21,You just said suicide
558801133141753856,12,No it wasn’t
558801170940952576,45,Noah said it wasn’t illegal to commit suicide
558801188183605278,23,And you said yes it was
558801248552222732,67,You were responding not positing_ and thus there was no implication
558801416655994881,45,No it’s not whole lot around assisted suicide
558801609140994049,13,He blocked me
558801658402963457,76,He said he has an irrational hatred towards me in other chat for some reason
558801726120132619,27,You were not proven correct
558801762106998794,66,You were proven correct in a different statement to what Noah said
558801794973827082,55,No it isn’t on that_ it’s on the right to kill yourself
558801820328263701,37,There’s two parts to the conversation
558801856491421736,36,Leave if you do not want to be civil
558801905590206504,37,no soz that’s what Noah said about me
558801927882932224,20,Idc if he blocked me
558801987374678038,11,No it isn’t
558802006836248627,22,This is not productive
558802112289701900,34,public schoolers are all plebs lel
558802216396390410,47,as with most_ the private sector does it better
558802315306467329,43,yeah bht it’s consensual to pay for it zero
558802342082773004,42,My mum pays for mine becos she has a brain
558802373733122058,41,And knows that state schools are btec asf
558802512413458433,100,State schools are fine_ but generally private schools will offer better service in exchange for cost
558802531942400001,40,I don’t see why it’s an either or debate
558803031823482880,54,Yeah but that’s not 12 years until the world is ending
558803270328385592,110,The article suggests 2100 as the timeframe when there is significant population damage as a result of flooding
558803408258334731,55,In the end it’s mostly inferior countries being hit tbh
558803474721013780,56,The US would mostly survive if there was severe flooding
558803499987501087,37,Along with much of continental Europe
558803522150465633,19,And the Middle East
558803546494074891,9,Okay cool
558803613045227520,47,The Mississippi River area isn’t most of the US
558803636449443860,26,Florida would be destroyed
558803784868823067,143,<@186569274628767745> yes im saying that a island countries in the pacific or Southeast Asia are less important globally than western countries
558803865928204341,112,<@325739257622691841> you only have me blocked because you disagree with me lol? Not very productive to anything
558803989882470416,47,Yeah I don’t sit in <#278625925170462720> daily
558804060954689540,17,I agree Cthulhuwu
558804222225809410,120,Ethnostates will always have eventual instability unless there’s actual genocide against all minorities within a country
558804675374350336,1,^
558804817515118612,29,That doesn’t mean neo-fascist
558804845046530073,19,Absolutely not woke
558805015959961621,71,Imagine blocking people in debates literally this is aids being blocked
558805158645989376,39,<@!378627967435145219> i shall revere u
558805190850117632,21,take my firstborn son
558805750491906060,106,<@186569274628767745> I’ve only entirely read your polish source_ which nowhere suggests a rise in fascism
558805795559440408,53,Can someone tell Cthulhuwu to check my messages there
558805936236396544,4,Bruh
558805991643152416,58,Imagine blocking and flaming people that disagree with you
558806070081093642,47,That’s the only reason May is still in office N
558806099000557597,51,Is because no one wants to captain her sinking ship
558806409911992341,82,Noah y do you even have me blocked aside from the irrational dislike u have for me
558806450584158219,1,👺
558806816977453057,70,I mean Noah we’ve had productive debates before idk why you blocked me
558807663895511050,176,Yeah but Cthuluwu your article on Poland only suggests the centralization of power in the executive as a result of the undermining of judicial independence not outright fascism
558808027000733716,82,That feeling when u read his articles but he has u blocked and won’t respond #epic
558808202020519936,28,Nah leftists have btec music
558809239963828243,26,as long as it’s consensual
558809297786765382,4,lmao
558809330875498497,9,epic zero
558809348537581594,2,Oh
558809360252272672,3,Gay
558809393983127553,22,My gf is in to iceplay
558809487696330754,40,as in she likes having ice rubbed around
558809944917278731,110,Can someone tell Cthuluwu to unblock me jesus I was trying to talk to him about polish judicial review earlier
558811892530020411,20,isn’t ancom just com
558812379224473770,103,<@!439926511517040680> I mean you’re not wrong that’s why people call it stuff like champagne socialism
559070096946102282,91,hierarchy still existed as hunter gatherers_ it just wasn't as formal as in an actual state
559070118207029269,19,for obvious reasons
559070532436361228,30,does anyone actual think  that
559070770370969621,21,i'm a conservative ig
559071184659021848,9,stay woke
559077517743357955,18,imagine doing stem
559077529198002206,14,absolute neeks
559077566980292620,21,thats even more neeky
559077603353559051,16,humanities > all
559077720211062784,24,dont entirely need 2 but
559077755866841119,47,humanities is still the best for true education
559077948913876992,110,yeah fr im going to uni in europe and even after rent in london my yearly cost will only be like 80/90k a year
559077961727475712,33,europe is so mcuh more affordable
559077973588967435,11,USA is rape
559078175141920858,8,stem bad
559078221296042120,52,made by the chad Ancient History/Classics major gang
559078519469244426,73,400k salary isnt that much especially with all the pressures of president
559078602831036438,21,call him an inbred ig
559078608241557515,2,oh
559078619960311859,15,georgia georgia
559078634653089821,21,call him btec armenia
559078868363903007,7,kanaken
559078886852526080,18,idk how u spell it
559078902920773692,43,thats what my german friends says turks are
559078994209800193,4,woke
