ID,Channel,Content Length,Content
558471157205041166,technical-bedrock,88,Does anyone know how to get the old texture pack back on the bedrock/windows 10 edition?
558471196790882313,skins-n-textures,88,Does anyone know how to get the old texture pack back on the bedrock/windows 10 edition?
558471259705442333,skins-n-textures,11,where from?
558471295759810572,skins-n-textures,45,ive looked in the store and dont see anything
558471347689488384,skins-n-textures,49,Can you impliment that on the windows 10 edition?
558471398826180618,skins-n-textures,10,lol thanks
558471546138656783,minecraft,88,Does anyone know how to get the old texture pack back on the bedrock/windows 10 edition?
558471662580924416,minecraft,7,thanks!
