ID,Author,Content Length,Content
558433936800350209,Fendoran,1054,These Codes is out of date for my currency system and i don't know what to do or how to fix it_ can't seem to find anything anywhere regarding this issue! please help!NLNLNLThis is the "OLD" code below _ something's faulty or otherwise just not working anymore_ if there's another way of doing this or any fixes to this_ i would appreciate all the work i can get_ this is all i need to get everything running again so if all of this could be working but differently i am forever grateful! ↴NLNL**Command Block Money Generator** (Adds chosen currency to player & removes entity log kill)NL```/scoreboard players add @p[score_vex_min=1] money 2NL/scoreboard players remove @p[score_vex_min=1] vex 1```NLNL**Shop Sign** (Removes chosen amount of currency & gives chosen item)NL```/give @p[r=3_score_money_min=10000] minecraft:spawn_egg 1 0 {EntityTag:{id:"Villager"}}NL/scoreboard players remove @p[r=3_score_money_min=10000] money 10000```NLNL**Added Entity** (Kill for chosen amount of currency)NL```/scoreboard objectives add creeper stat.killEntity.Creeper creeper```
558433938234671105,MEE6,62,Hey <@!245669771071324183>_ you just advanced to **level 6** !
558435569999413251,Sprinkles,23,Will this be for 1.13+?
558435599250489351,Fendoran,17,newest update yes
558435713385889804,Sprinkles,515,Let me check if I got an objective name right_ but otherwise here's my response:NLNLI could directly convert these commands into their 1.13+ form.NL```/scoreboard players add @p[scores={vex=1..}] money 2NL/scoreboard players remove @p[scores={vex=1..}] vex 1```NL```/give @p[distance=..3_scores={money=10000..}] minecraft:ghast_spawn_egg{EntityTag:{id:"minecraft:villager"}}NL/scoreboard players remove @p[distance=..3_scores={money=10000..}] money 10000```NL```/scoreboard objectives add creeper killed:creeper creeper```
558435796395360256,Fendoran,23,would u do that for me?
558438596533813248,Fendoran,7,oh wait
558438615819223051,Fendoran,25,this is the updated form?
558438631715504153,Sprinkles,7,Yessir!
558438847374163988,Fendoran,80,so why'd they change all this_ i mean_ what was the problem with the old system?
558439122482757642,Sprinkles,226,The old system was inefficient_ outdated_ and crude with lots of useless commands. This updated system has a new parser_ completely rewritten commands and storage_ and merged useless commands into others so they became useful.
558439287213785098,Fendoran,132,so you recognise ?NL```/scoreboard players add @p[scores={vex=1..}] money 2NL/scoreboard players remove @p[scores={vex=1..}] vex 1NL```
558439317530214429,Fendoran,28,ever used it before_ i mean?
558439451752267806,Sprinkles,84,I have_ yeah. Scores use ranges instead of "at least <number>" or "at most <number>"
558439501634994177,Sprinkles,234,If I wanted to store the number of items I have in my hand to a score_ I'd runNL`/execute as @p store result score @s itemCount run data get entity @s SelectedItem`NLWe can do so much more thanks to the changes in the commands from 1.13
558439522292203521,Fendoran,22,ok so i got a question
558439553443299329,Fendoran,23,idk if you had the same
558439590474678272,Fendoran,59,but i used to have 2 command blocks side by side each other
558439610762657812,Fendoran,31,each with the different command
558439644014968833,Fendoran,50,with redstone and the other thing i can't remember
558439666337054721,Fendoran,32,constantly blinking to be active
558439782431064074,Fendoran,35,any more efficient way of doing it?
558439825707892737,OMSIN,53,<@482247702311337985> Are there anyone andwered you ?
558439905429159946,Sprinkles,47,I assume you mean running a command constantly?
558440035133816852,Fendoran,67,it kinda has to if they want instant money from killing a creature?
558440298146037766,Sprinkles,196,Redstone and commands don't mix well these days_ but some people use them still. Repeating command blocks run their commands twenty times per second_ if you need commands to be running that often.
558440347454406676,OMSIN,63,<@482247702311337985> I guess you are using Linux_ am I right ?
558440450294284292,Fendoran,73,so how does that even work_ so 2 command blocks on top of eachother right
558440625700077577,Fendoran,172,This one at the bottom with Repeating and Always ActiveNL```/scoreboard players add @p[scores={vex=1..}] money 2```NLNL```/scoreboard players remove @p[scores={vex=1..}] vex 1
558441131340333086,Sprinkles,138,You can use a repeating command block for the first_ and point that into an always active chain command block. They will execute together.
558441251305816085,Fendoran,73,do they have to be side by side or can they also be on top of each other?
558441691128791041,Fendoran,69,btw_ NL```/scoreboard objectives add creeper killed:creeper creeper```
558441711743795243,Fendoran,31,seem to not be working properly
558441862634012682,Fendoran,25,the problem is at the end
558441890534391839,Fendoran,23,with the "display name"
558441939381256193,OMSIN,372,<@482247702311337985> Please check:NLNLHave u restart the server_ if not pls try restart it.NLNLAre you hosting multiple server ? (Pls run 1 at once)NLNLHave you check the port forward config again ? (It may turned off my itself for some reason)NLNLAre u sure that the server is currently running at port 25565 ?NLNL... If these cannot help_ try restart your computer and try again.
558441961359540249,Sprinkles,110,Ah_ that's a JSON component. For simplicity's sake_ you can shorten that to `"creeper`" with quotes around it.
558442097418436609,Fendoran,18,ahh i need "" then
558442110022451245,Fendoran,3,but
558442120705212467,Sprinkles,95,And no_ command blocks can be in essentially any rotation as long as they point into each other
558442392567545859,Fendoran,180,Ok so wich of these oes into wich? first one purple and second one green?NL/scoreboard players add @p[scores={vex=1..}] money 2NL/scoreboard players remove @p[scores={vex=1..}] vex 1
558442466517319702,Sprinkles,59,Yep. if you did it the other way around_ it might not work.
558442561782677504,Fendoran,30,and set both to always active?
558442590601609229,Sprinkles,4,Yes.
558442743475470347,OMSIN,88,The green one need to be always active if you want it to always run with the purple one.
558442858030432257,OMSIN,65,The purple one you can place redstone to activate it when u need.
558442941920706570,OMSIN,69,It's okay to set it to always active if you decided to always run it.
558442950388875284,Fendoran,37,but it can also be always active yes?
558442974976016384,Sprinkles,12,It can_ yes.
558443028801519640,Fendoran,28,ok another dumb question inc
558443075832119306,Fendoran,50,how do i make them line in so perfectly as you did
558443156950220810,Sprinkles,39,They're rotational_ similar to pistons.
558443316237303818,OMSIN,38,The arrow points to u when u place it.
558443381424914453,Fendoran,20,ok gonna test it now
558443582604836864,Fendoran,7,oh shit
558443621335040002,Fendoran,28,forgot how to add money also
558443722170302485,Fendoran,31,the add scoreboard money money?
558444115394560001,Sprinkles,4,Huh?
558444292671012864,Fendoran,55,you know the side objective that displays your currency
558444400838049817,Sprinkles,49,It's not working now? What were you using before?
558444434996330506,Fendoran,3,uhm
558444445633216568,Fendoran,12,let me check
558444659496714252,Fendoran,114,Something like this?NL```/scoreboard objectives add money DollarNL/scoreboard objectives setdisplay sidebar money```
558444864002588682,Sprinkles,186,`Dollar`'s not a valid objective. If you're looking for an objective that doesn't change until you tell it to_ you would use `dummy`.NL```/scoreboard objectives add money dummy "Dollar"``
558445012866564117,Fendoran,38,and the setdisplay should be the same?
558445065337307137,Sprinkles,30,Yeah. That part hasn't changed
558445275568406531,Fendoran,30,idk if've done something wrong
558445290437476352,Fendoran,22,but not working for me
558445339447787552,Fendoran,0,
558445363904774144,Fendoran,0,
558445390240677888,Fendoran,0,
558445997236420629,Sprinkles,117,Is `zombie` a valid objective? If so_ make sure your score's increasing. Otherwise I'm not sure why it's not working.
558446122436263937,Fendoran,10,i added it
558446379672928258,Fendoran,7,ahh yeh
558446392163434517,Fendoran,16,it's working now
558446716953821207,Sprinkles,13,Good to hear!
558447070814404610,LitNotFig,3,hey
558447084550881319,LitNotFig,19,can someone help me
558447137705295885,LitNotFig,63,im working on a minecraft map and it keeps sending me a message
558447383545905153,LitNotFig,62,it keeps saying Command Blocks are not enabled on this server.
558447564328796170,Fendoran,37,go to config file in ur server folder
558447580057698324,Fendoran,18,and set it to true
558447659527045122,Fendoran,45,*find Command Block:falseNLand set it to true*
558447752615428106,Sprinkles,79,I'd say the actual name of the file_ but the moderation bot tends to delete it.
558447813260869662,Fendoran,9,sprunkles
558447844734795776,LitNotFig,12,its not here
558447865698058240,Fendoran,57,you know any good sites to generate codes signs for shop?
558447893724528651,LitNotFig,24,can I send someone a pic
558447915178393639,Fendoran,69,i used to use https://minecraftcommand.science/command-sign-generator
558447916201803800,LitNotFig,13,of the config
558447933608165399,Fendoran,18,but it's for 1.8..
558447962762641413,Sprinkles,39,It's in the server(dot)properties file.
558448095550242837,Sprinkles,70,Until I memorized JSON_ I used this site: <https://minecraftjson.com/>
558448254350655499,LitNotFig,2,oh
558448255478792193,MEE6,62,Hey <@!427497508340760586>_ you just advanced to **level 1** !
558448271270608896,LitNotFig,14,he said config
558448367714435072,LitNotFig,40,also how do i make it so mobs dont spawn
558448432352591891,Fendoran,94,does this site allow me to just paste in a code_ or do i have to actualy type in shiet myself?
558448546374877199,LitNotFig,37,wait_ I can change the resourse pack?
558448674645213184,Sprinkles,91,You click the Add Text button_ then insert some text at the top_ then click Add Text again.
558448808577466411,Sprinkles,47,Although... it seems this isn't updated either.
558448930493562910,Sprinkles,246,lol this was the `/give` command it gave me:NL```/give @p sign 1 0 {BlockEntityTag:{Text1:"[\"\"_{\"text\":\"asd\"}]"_id:"Sign"}}```NLWhen it should look like this:NL```/give @p sign{BlockEntityTag:{Text1:"[\"\"_{\"text\":\"asd\"}]"_id:"Sign"}} 1```
558449115596324891,Sprinkles,97,It's especially wrong in 1.14_ as oak/spruce/etc. types of signs exist. So it's a little outdated
558449137868079105,Fendoran,209,what if i wanted a sign for ```/give @p[distance=..3_scores={money=5..}] minecraft:ghast_spawn_egg{EntityTag:{id:"minecraft:villager"}}NL/scoreboard players remove @p[distance=..3_scores={money=5..}] money 5```
558449162929307654,LitNotFig,46,how do you put that weird box around the text?
558449247679414282,Fendoran,48,with 3x ` at the beginning and the end of a text
558449307166965762,Sprinkles,128,You use backticks. It's good for ignoring discord's formatting.NL\`small block\`: `example`NL\`\`\`code block\`\`\`:NL```example```
558449430387228682,Sprinkles,69,It also supports syntax highlighting.NL```jsonNL{NL    "example": 1NL}```
558449525099069450,Sprinkles,37,A sign that... does those things? hmm
558449596070756352,LitNotFig,9,thank you
558449613204488212,Fendoran,64,mhm_ is what i used to have_ i also had nice coloring etc etc...
558449619869106187,LitNotFig,24,now all my commands work
558449659505278978,LitNotFig,51,can i send one of you all the command blocks i used
558449976129355776,Sprinkles,143,The issue with having commands like that on a sign is players will need operator permissions to run certain commands like `/give` or `/gamemode
558450032387555328,Sprinkles,21,You could_ sure [Lit]
558450042764001280,Fendoran,28,didn't use to when i had it?
558450124682952705,Fendoran,33,i think i had like tellraw though
558450309395906560,Sprinkles,204,If you want players to be able to interact with things on signs with click events like that_ you could set up a trigger objective with the `/trigger` command instead. That's what that command was made for
558450500165566526,Fendoran,37,I'm not experienced with these things
558450521623625729,Fendoran,25,so i wouldn't know how to
558450897504567296,LitNotFig,51,can someone come on my server and test this with me
558451225188892674,Sprinkles,618,Trigger objectives are scoreboards that anyone can modify for themselves. They need to be activated first to change them_ and deactivate when modified.NLYou could have a sign with a click event to run a `/trigger` command that changes a trigger scoreboard_ and check if a player's score changes.NLNLLet's pretend we have a trigger objective called "test". In the sign you got your click event that has this: `/trigger test`NLThe command succeeds_ then you check for the score change in another command block: `execute as @a if score @s test matches 1.. run <command>`NLIt's rather hard to explain_ but that's the basic idea
558451533935673355,Fendoran,21,shoouldn't be needed?
558451582543593473,Fendoran,58,all my signs on my old server noone had problems accesing?
558451702160949248,Sprinkles,93,They must have had some kind of permission to use them. Or there was some mod magic happening
558451749577293844,Sprinkles,53,Non-operator players shouldn't have access to `/give`
558452173885669377,Fendoran,22,well they could anyway
558452430551908362,Fendoran,31,but anyways_ first things first
558452468430929921,LitNotFig,43,can someone come and test this for with me/
558452545509654528,Fendoran,544,noone has updated their websites to make something like ```/give @p sign 1 0 {BlockEntityTag:{Text1:"{\"text\":\"Villager Egg\"_\"color\":\"blue\"}"_Text2:"{\"text\":\"Villager Egg\"_\"clickEvent\":{\"action\":\"run_command\"_\"value\":\"/give @p[distance=..3_scores={money=5..}] minecraft:ghast_spawn_egg{EntityTag:{id:\\"minecraft:villager\\"}}\"}}"_Text3:"{\"text\":\"$ 5_- \"_\"clickEvent\":{\"action\":\"run_command\"_\"value\":\"/scoreboard players remove @p[distance=..3_scores={money=5..}] money 5\"}}"}_display:{Name:"Custom Sign"}}```
558452706340241418,Fendoran,7,and btw
558452722542837771,MEE6,62,Hey <@!245669771071324183>_ you just advanced to **level 7** !
558452730725793812,Fendoran,29,this is to give "me" the sign
558452736383909928,Fendoran,8,not them
558452786220761098,Fendoran,81,i use a command block to give me the sign and then i hang it op for people to use
558453010850643998,OMSIN,58,I think it the same like get people to run /give ghast egg
558453064462237726,OMSIN,40,And they have no permission to use /give
558453114579976203,Fendoran,18,they don't have to
558453145693323274,Fendoran,40,the /give is to give me the sign anyways
558453225712517123,OMSIN,75,Clicking the sign is the same with shortcut for running command_ isn't it ?
558453299154518016,Fendoran,13,it's the idea
558453497776046120,Sprinkles,540,Most of that is the same_ just changing this:NL```jsonNL/give @p oak_sign{BlockEntityTag:{Text1:"{\"text\":\"Villager Egg\"_\"color\":\"blue\"}"_Text2:"{\"text\":\"Villager Egg\"_\"clickEvent\":{\"action\":\"run_command\"_\"value\":\"/give @p[distance=..3_scores={money=5..}] minecraft:ghast_spawn_egg{EntityTag:{id:\\\"minecraft:villager\\\"}}\"}}"_Text3:"{\"text\":\"$ 5_- \"_\"clickEvent\":{\"action\":\"run_command\"_\"value\":\"/scoreboard players remove @p[distance=..3_scores={money=5..}] money 5\"}}"}_display:{Name:"Custom Sign"}}```
558453517862305815,OMSIN,76,So when people click the sign_ it's the same with typing /give .............
558453518588182529,Dyno,34,<@551678168348491786> No spamming.
558453559985963029,Sprinkles,50,Oh_ I'm in 1.14 so `oak_sign` might not exist yet.
558453564381462529,OMSIN,19,Wt* am I spamming ?
558453718303899649,OMSIN,22,... Sorry if I'm wrong
558453739317362689,OMSIN,3,-.-
558454181892194304,Fendoran,7,oh shit
558454249445654528,Fendoran,63,could u possible remove text line 1 and make text line 3 green?
558454606317748224,Sprinkles,483,```jsonNL/give @p oak_sign{BlockEntityTag:{Text1:""_Text2:"{\"text\":\"Villager Egg\"_\"clickEvent\":{\"action\":\"run_command\"_\"value\":\"/give @p[distance=..3_scores={money=5..}] minecraft:ghast_spawn_egg{EntityTag:{id:\\\"minecraft:villager\\\"}}\"}}"_Text3:"{\"text\":\"$ 5_- \"_\"color\":\"green\"_\"clickEvent\":{\"action\":\"run_command\"_\"value\":\"/scoreboard players remove @p[distance=..3_scores={money=5..}] money 5\"}}"}_display:{Name:"\"Custom Sign\""}}```NLLike that?
558454821309382656,caelan08,39,butt holls<:reactor:309478404208590849>
558455340748898325,Fendoran,108,and let's say if i wanted a different color on the same line with a text_ could i just put it infront of it?
558455776159727646,Sprinkles,147,Two different colors... it's a little tricky.NL```jsonNL"[\"\"_{\"text\":\"Red\"_\"color\":\"red\"}_\" \"_{\"text\":\"Blue\"_\"color\":\"blue\"}]"```
558456877046824980,Fendoran,27,tried to put it into text 2
558456935536394256,Fendoran,34,but seems like it's cooperating xD
558457113081413632,Sprinkles,40,Worked for me. What command did you use?
558457427553419308,Fendoran,33,sorry tried to put it into text 3
558457441998864454,Fendoran,14,let me link it
558457613302366219,Fendoran,513,```/give @p sign{BlockEntityTag:{Text1:""_Text2:"{\"text\":\"Villager Egg\"_\"clickEvent\":{\"action\":\"run_command\"_\"value\":\"/give @p[distance=..3_scores={money=5..}] minecraft:ghast_spawn_egg{EntityTag:{id:\\\"minecraft:villager\\\"}}\"}}"_Text3:""[\"\"_{\"text\":\"Red\"_\"color\":\"red\"}_\" \"_{\"text\":\"Blue\"_\"color\":\"blue\"}]"_\"clickEvent\":{\"action\":\"run_command\"_\"value\":\"/scoreboard players remove @p[distance=..3_scores={money=5..}] money 5\"}}"}_display:{Name:"\"Custom Sign\""}}```
558457634642984960,Fendoran,4,hehe
558458192280158228,Sprinkles,201,`Text3:""[\"\"_{\"text\":\"Red\"_\"color\":\"red\"}_\" \"_{\"text\":\"Blue\"_\"color\":\"blue\"}]"_`NLThe error lies in the JSON text being outside the original quotes_ and an extra quote on the outside
558458508497125376,Fendoran,57,either I'm stupid or I'm doing something incredibly wrong
558459557790351371,Fendoran,543,I feel this should be correctNL```/give @p sign{BlockEntityTag:{Text1:""_Text2:"{\"text\":\"Villager Egg\"_\"clickEvent\":{\"action\":\"run_command\"_\"value\":\"/give @p[distance=..3_scores={money=5..}] minecraft:ghast_spawn_egg{EntityTag:{id:\\\"minecraft:villager\\\"}}\"}}"_Text3:""[\"\"_{\"text\":\"Red\"_\"color\":\"red\"}_\" \"_{\"text\":\"Blue\"_\"color\":\"blue\"}]"_\"clickEvent\":{\"action\":\"run_command\"_\"value\":\"/scoreboard players remove @p[distance=..3_scores={money=5..}] money 5\"}}"}_display:{Name:"\"Custom Sign\""}}```
558460244364230716,Sprinkles,51,`Text3:""[\"`*`<--[HERE]`*NLThe issue still persists
558460323271802880,Sprinkles,40,The JSON is outside the quotation string
558460439550492702,Sprinkles,130,Should look like this:NL```jsonNLText3:"[\"\"_{\"text\":\"Red\"_\"color\":\"red\"}_\" \"_{\"text\":\"Blue\"_\"color\":\"blue\"}]"```
558460807516651551,Fendoran,512,```/give @p sign{BlockEntityTag:{Text1:""_Text2:"{\"text\":\"Villager Egg\"_\"clickEvent\":{\"action\":\"run_command\"_\"value\":\"/give @p[distance=..3_scores={money=5..}] minecraft:ghast_spawn_egg{EntityTag:{id:\\\"minecraft:villager\\\"}}\"}}"_Text3:"[\"\"_{\"text\":\"Red\"_\"color\":\"red\"}_\" \"_{\"text\":\"Blue\"_\"color\":\"blue\"}]"_\"clickEvent\":{\"action\":\"run_command\"_\"value\":\"/scoreboard players remove @p[distance=..3_scores={money=5..}] money 5\"}}"}_display:{Name:"\"Custom Sign\""}}```
558460820422656021,Fendoran,10,am i dumb?
558460827963883522,Fendoran,5,dafuq
558463619998941224,Sprinkles,38,That should work. Encountering issues?
558463657860661270,Fendoran,3,yep
558463666727682068,Fendoran,12,all red text
558463681936097293,Fendoran,22,not giving me anything
558464081485496331,Sprinkles,45,What does the error say in the command block?
558464220254175233,Fendoran,0,
558464902642270218,Sprinkles,328,``blue\"}]"_\"clickEvent\"``NLThe issue is the clickevent is outside the component.NL```jsonNLText3:"[\"\"_{\"text\":\"Red\"_\"color\":\"red\"}_\" \"_{\"text\":\"Blue\"_\"color\":\"blue\"_\"clickEvent\":{\"action\":\"run_command\"_\"value\":\"/scoreboard players remove @p[distance=..3_scores={money=5..}] money 5\"}}]"```NLtry that
558465534815895562,Fendoran,524,like so?NL```/give @p sign{BlockEntityTag:{Text1:""_Text2:"{\"text\":\"Villager Egg\"_\"clickEvent\":{\"action\":\"run_command\"_\"value\":\"/give @p[distance=..3_scores={money=5..}] minecraft:ghast_spawn_egg{EntityTag:{id:\\\"minecraft:villager\\\"}}\"}}"_Text3:"[\"\"_{\"text\":\"Red\"_\"color\":\"red\"}_\" \"_{\"text\":\"Blue\"_\"color\":\"blue\"_\"clickEvent\":{\"action\":\"run_command\"_\"value\":\"/scoreboard players remove @p[distance=..3_scores={money=5..}] money 5\"}}]"\"}}"}_display:{Name:"\"Custom Sign\""}}```
558466327933616128,Sprinkles,173,Almost. There should be a right square bracket `}` after that last part_ at:NL...`money 5\"}}]"_display`...NLbetween the quotation mark and the comma. `money 5\"}}]"}_display`
558466420988575775,Sprinkles,60,As the `display` tag isn't apart of the `BlockEntityTag` tag
558467345623023616,Fendoran,14,finaly got it!
558467378430869514,Fendoran,21,jesus how complicated
558467698305138719,Fendoran,46,so you agree that once i give myself this sign
558467706920370187,Fendoran,14,and put it out
558467735902748672,Fendoran,39,noone needs commands to click on it 😃 ?
558468653029523457,Sprinkles,57,If they have operator permissions_ anyone can use it yeah
558468761645088789,Fendoran,70,so without operator permission noone can use it is what you're saying?
558468805508988939,Sprinkles,53,Basically. You'd need to use a `/trigger` click event
558468836093853716,Fendoran,36,now i mean without the /give command
558468949956755466,Fendoran,66,because the command they're basically using is /scoreboard players
558469142060072960,Sprinkles,62,Non-op'd players don't have access to `/scoreboard` or `/give`
558469517299417099,Fendoran,88,i swear to you i've seen people use it and it works_ but i can't test it untill tomorrow
558469569908310025,Fendoran,61,mind me contacting you if it doesn't for a possible solution?
558469623373103126,Fendoran,29,gonna have to go to sleep now
558469873806737408,Sprinkles,73,I'm not sure if I will be up when you contact me_ but you can if you wish
558470058448388126,Fendoran,61,I will try_ you could always leave a reply whenever you can 😃
558470811556511785,CultivatingWithCameron,45,When you deop yourself on your own server....
558470884881596417,CultivatingWithCameron,36,Then you realized that you messed up
558472278547890186,The Llama Next Door,65,How does this server have a /minecraft invite instead of numbers?
558472463587999762,Sprinkles,98,it's an official partnered server (or the owner is a discord partner) so they get a custom invite.
558472556198494209,Sprinkles,88,The owner of the Terraria server's a discord partner_ and they have a custom invite too.
558472717607632896,The Llama Next Door,43,Does that have to do with the vericication?
558472811572625431,Sprinkles,109,Maybe? I know for sure it has to do with the Discord Partner thing_ but maybe verified servers get those too.
558472835916627978,The Llama Next Door,2,Ok
558472883639418909,The Llama Next Door,26,Do most servers have that?
558472912886300672,Sprinkles,26,A verification symbol? no.
558473036055969792,The Llama Next Door,34,Do most servers have a partnership
558473134777303100,Sprinkles,82,That I'm not sure of. Some discord members are Discord Partners_ not many of them.
558473183334891521,The Llama Next Door,12,Oh ok thanks
558755060214136832,zorenine,220,Ohh okay.  I use to have that mod but then I found something so disappointing. Your not able to do double dmg when duel wielding. like that to me just destroys the whole entire purpose of duel wielding in the first place
558755090211667980,WilliamBac,135,Hello_ so my account password has no been changed (at least I hope not)_ yet I can no longer login. It sayd invalid username/passerword
558755101406265395,WilliamBac,12,what do I do
558755211729174530,Archez,47,<@304757722786562048> restore password by email
558755313092657162,WilliamBac,53,The account is many years old_ long lost the password
558755332868931586,WilliamBac,12,to the email
558755425009532939,Archez,37,Did you forget email to this account?
558755497822650408,WilliamBac,42,I have the email_ not the email's password
558755536003268629,{ᏝᏬᏒᏦᏕ},17,recover password?
558755538708725790,Archez,12,i understans
558755618303901717,WilliamBac,82,Send a support ticket_ but those things dont get reponses until like 5 weeks later
558755634619613214,WilliamBac,15,if you're lucky
558755642224017448,{ᏝᏬᏒᏦᏕ},57,<#302987265229979649> has pin message about account stuff
558755713623654400,WilliamBac,72,what are the chances that I can just wait a while  and it'll work again?
558755731554435072,Archez,45,<@304757722786562048> did you phoned to them?
558755743327715329,Grubeis,178,I hope you will be able to understand this. I want to make a chest that when opened it will drop all its loot on the ground right below it_ and removing the chest in the proccess
558755745428930575,MEE6,62,Hey <@!482247702311337985>_ you just advanced to **level 7** !
558755760423567380,WilliamBac,1,?
558755783752548372,WilliamBac,25,you mean did I call them?
558755790312308779,{ᏝᏬᏒᏦᏕ},47,mojang is heavily backlog on tickets i've heard
558755794255085578,Grubeis,3,Lol
558755805629906954,Archez,3,yes
558755816552005632,WilliamBac,2,No
558755837284319242,Archez,21,to technicall support
558755852111052810,WilliamBac,16,Would that help?
558755947258839062,WilliamBac,46,I feel that that probably wouldn't do too much
