ID,Server,Channel,Content Length,Content
558765533692952610,/r/ProgrammerHumor,media,6,nodeOS
560625133534838804,/r/ProgrammerHumor,off-topic,68,oofNLNext time you see them just say cornn flaek and see what happens
560627958860218388,/r/ProgrammerHumor,programming,88,The way I (badly) did it was a Token struct with an enum for type and a string for value
560649029281644564,/r/ProgrammerHumor,general-discussions,37,I feel like a terrible pun lies there
560649115550351371,/r/ProgrammerHumor,general-discussions,57,"I may be a software engineer_ but I'm anything but soft"
