ID,Server,Channel,Content Length,Content
558755220197343236,Official Fortnite,battleroyale-images,1,😂
558767109165809664,Official Fortnite,battleroyale-images,79,No flex btw just on mobile and versing sweaty tryhards like me on the same day.
558768029870194689,Official Fortnite,lfg-battleroyale-mobile,47,What is everyone’s highest kills on mobile solo
558768727470899200,Official Fortnite,battleroyale-images,26,It’s coming for dem brains
558781583960702996,Official Fortnite,battleroyale-images,3,Lol
