ID,Channel,Content Length,Content
558458863632908290,general,17,eat my fuck bitch
558829109195571202,general,18,china give me land
558830796895420437,general,65,what is the highest you have ever gotten on the google snake game
558830848791674891,general,4,fugk
558830871721934923,general,17,my highest is 139
560635369448538123,general,32,we should watch the big lebowski
560635416643108864,general,18,great fuckin movie
560636047348989974,general-2-electric-boogaloo,14,i am a bit sad
560636095356993537,general-2-electric-boogaloo,33,my book was destroyed in the rain
560636103716110342,general-2-electric-boogaloo,1,F
