ID,Server,Channel,Content Length,Content
560609073137975317,MINECRAFT,minecraft,36,the best weapon in minecraft is dirt
560609104859496448,MINECRAFT,minecraft,2,XD
560609148924985385,MINECRAFT,minecraft,3,oof
560609276674965506,MINECRAFT,minecraft,51,which kind of update do you think will happen next?
560609421542031360,MINECRAFT,minecraft,66,rumors say it might be the reworked combet update or a cave update
560609489410064394,MINECRAFT,minecraft,7,mee too
560609688278794240,MINECRAFT,minecraft,45,who here thinks the bats ned to get reworked?
560609779114967100,MINECRAFT,minecraft,21,and add some new ores
560610000616292362,MINECRAFT,minecraft,100,except the first one out of the two is the combat update because more things point in that direction
560610310537478154,MINECRAFT,minecraft,56,which do you think is better?NLgold pick or diamond pick?
560652944819617802,MINECRAFT,minecraft,17,waluigi for smash
