ID,Channel,Content Length,Content
560949195054514178,bedrock-store-feedback,26,theyre available on mcpedl
560949251379822612,bedrock-store-feedback,33,how many free maps have you made?
560949433756549120,bedrock-store-feedback,83,that would be cool_ but that doesnt really have anything to do with the marketplace
560950084162813970,bedrock-store-feedback,55,not true_ dlc was already avalble on consoles back then
560950128870031360,bedrock-store-feedback,56,and you had to buy it on mobile and every other platform
