ID,Content Length,Content
560642402294169640,128,I can't relate to caring too much because I can't relate to ever having cared about someone that significantly outside my family
560642411471175700,10,Incel gang
560642535144423438,9,Fuck dude
560642560238813224,21,I gotta get out there
560642634918658048,21,Nah like meet someone
560642665842999306,11,Nowhere lol
560642736282271744,74,Actually I'm going to San Diego tomorrow morning so ig I'm going somewhere
560644541858971690,42,Went to england_ stayed in downtown london
560644600532959258,65,No offense but I've never seen so many cars that scream oil money
