ID,Server,Channel,Content Length,Content
558758869254275083,Official Fortnite,lfg-battleroyale-console,26,Is it a good default clan?
558759654499549216,Official Fortnite,lfg-battleroyale-console,2,Me
558763295419662378,Official Fortnite,fortnite-general,22,Anyone wanna do Squads
558765621672804362,Official Fortnite,fortnite-general,35,Can anyone get me that Laguna pack?
558768986506919954,Official Fortnite,fortnite-general,18,Raptor can I join?
558859340799541258,Official Fortnite,lfg-battleroyale-console,42,Anyone wanna play NAE Squads dm me ur epic
