ID,Content Length,Content
560285466784432139,3,Why
560285542173114368,28,Pick one good for your major
560285562318356490,22,Or if it’s about money
560285613350453248,44,Then go to the one with the best scholarship
560285669306662924,5,Major
560285713128620052,36,See which one is really good for you
560285750088957952,40,And which one has the best opportunities
560285830858539010,73,Mine has an animal hospital which is good for me bc im in animal sciences
560285870846902293,23,That’s a lot of schools
560285979773108259,85,You’d need to look into those each separately and see reviews regarding the major too
