ID,Server,Channel,Content Length,Content
558427590373801995,MINECRAFT,minecraft,33,Hello who has a realm I can join?
558427923179241473,MINECRAFT,multiplayer,32,Hello who has a realm I can join
558441489487757332,MINECRAFT,multiplayer,47,I'm looking for a a good realm with Good people
558778935568105506,MINECRAFT,off-topic,30,Anyone here a realm I can join
558779063703961630,MINECRAFT,off-topic,42,Dm me if anyone has a realm I can join plz
558779239864729623,MINECRAFT,multiplayer,20,Any realm I can join
