ID,Channel,Content Length,Content
559109427161202700,fortnite-general,50,i need to know ``IS SCENARIO COMING TO ITEM SHOP``
559109674603905025,fortnite-general,162,no one knows.. the world will never know.... life or death_ either which_ we'll never know if fortnite will release scenario to item shop... (jesus this was deep)
559110200519294983,fortnite-general,6,spoons
559110397995778068,fortnite-general,135,also i want a selectable style for lil' whip where there's a literal spoon in his head_ and him melting_ with his cone body just broken
559110667068506119,fortnite-general,25,also make lynx thicker pl
