ID,Server,Channel,Content Length,Content
558757083374288916,Official Fortnite,fortnite-general,7,help :c
558757174336028692,Official Fortnite,fortnite-general,42,<@508694819648962571> whats in the account
558757268179517480,Official Fortnite,fortnite-general,25,I just cant play fortnite
558757440397639682,Official Fortnite,fortnite-general,40,I do stupid mistakes and i cant iprove 😐
558758020633460757,Official Fortnite,lfg-creative,105,Is anyone weanling to help me improve in fortnite | I keep doing stupid mistakes and cant aim straight :c
558787735645585409,Official Fortnite,lfg-creative,151,is anyone whilling to help me improve in fortnite_ I aint new i just do simple mistakes and wanna be that people with alot of kills dm if u can help me
558788267659493386,Official Fortnite,lfg-creative,17,I am good for now
