ID,Server,Channel,Content Length,Content
558992393437839360,Official Fortnite,lfg-battleroyale-pc,27,NEED 1 SWEAT EU ENGLISH 14+
558993644867158026,Official Fortnite,lfg-battleroyale-pc,68,looking for a duo partner SWEAT that wants to do gauntlet english !!
559062598608224274,Official Fortnite,lfg-battleroyale-pc,38,need gauntlet partner sweat eu english
559062836224065598,Official Fortnite,lfg-battleroyale-pc,42,need gauntlet partner SWEAT!! EU english!!
559063242249601038,Official Fortnite,lfg-battleroyale-pc,42,need gauntlet partner SWEAT!! EU english!!
559063458264514589,Official Fortnite,lfg-battleroyale-pc,42,need gauntlet partner SWEAT!! EU english!!
