ID,Channel,Content Length,Content
558843168309903370,multiplayer,27,someone please play with me
558843290116554774,minecraft,120,i am so scared of the enderman in my minecraft village that i cant play alone. someone pls play with me im scared of him
558843429162057766,minecraft,1,😦
558843803465940992,multiplayer,19,Please play with me
558844396741853194,multiplayer,232,i am scared of endermen and there is an endermen in my minecraft village trying to kill me. I am terrified to play alone on my Java Realm 1.13.2 😦 The enderman is in my village stealing blocks too near the ocean  and I want him gone
558845862000984124,multiplayer,29,SOMEONE PLEASE PLAY WITH MEEE
558846370996289536,multiplayer,35,im scared to play on my realm alone
