ID,Server,Channel,Content Length,Content
558451754077782032,MINECRAFT,minecraft,150,Maybe I should redo my survival world and get some redstone and play around with that and try to make a good_ but not so overpowered and huge cow farm
558755035660550145,MINECRAFT,minecraft,49,My favorite block would have to be the birch wood
558755160273453088,MINECRAFT,minecraft,42,I do like the stained glass as well though
558755420282552320,MINECRAFT,minecraft,32,I would rather the Diamond sword
558756466924716116,MINECRAFT,minecraft,60,If anything Minecraft is evolving and for the better I think
558756708793581568,MINECRAFT,minecraft,32,Make spelunking great again lmao
559031549098721292,/r/Anime Discord!,general,65,<@66207186417627136> just in bed and need to sleep but hungry boi
559031656728756235,/r/Anime Discord!,general,18,Wagwan rudeboiiiii
559031744423002122,/r/Anime Discord!,general,18,Time to diet sallz
559031946366156810,/r/Anime Discord!,general,23,<@291956350286561282> o
559031982328381470,/r/Anime Discord!,general,3,189
559032192651755520,/r/Anime Discord!,general,27,That's a stupid height lmao
559032230475989022,/r/Anime Discord!,general,28,Atleast you get to eat a lot
