ID,Channel,Content Length,Content
558844824548278313,off-topic,30,my wifi seems to be shit today
558845218976301077,off-topic,40,i wanna install apex legends reeeeeeeeee
558845257324691486,off-topic,31,i wanna install apex legends D:
558845979164409876,off-topic,24,YOUR CAT LOVES YOUR FACE
558846008566743061,off-topic,24,MY WIFI REAL FUCKEN SHIT
558846185444474921,off-topic,26,THE FUCK IS WITH THIS WIFI
558858383894118400,off-topic,49,my wifi goes to shit whenever i turn on my laptop
558865092721115136,beta-n-bugs,20,Is this for bedrock?
