ID,Server,Channel,Content Length,Content
558764627903905804,MINECRAFT,multiplayer,30,anyone wanna play factions 1.9
558767747861839872,MINECRAFT,multiplayer,41,anyone wanna play some factions 1.9 DM me
558768255506972674,MINECRAFT,multiplayer,75,looking for an server for the uk thats faction then Dm me also giving keys!
558769073295458344,MINECRAFT,multiplayer,55,wanna join my uk based server looking for players Dm me
558770082163982340,MINECRAFT,multiplayer,74,wanna play factions 1.9 giving discord users crate keys DM me btw its bata
