ID,Content Length,Content
558428377103597568,32,who has a clean realm i can join
558435837872832522,33,who has a clean realm i  can join
558436730705936394,28,any clean realms i can joins
558845156368056330,68,who has a realm i can join i  want to play spirits statigy and sheep
558846127177465886,93,who has a realm i can join i  want to play spirits statigy and sheep and it needs to be clean
558854452350812172,93,who has a realm i can join i  want to play spirits statigy and sheep and it needs to be clean
