ID,Content Length,Content
560621364310966272,65,Anyone that's some good want to play? I want the victory umbrella
560623956093042698,127,Anyone want to play. I'm ok at the game I just want a win this season. As long as your good at the game Luke 50+ wins I'll play
560624772287823882,144,Dm me if you want to play. I am bored . I'm ok at the game and have a decent amount of wins like 20. NLI play na west I believe and I play on ps4
560640343515594771,69,<@412025129757835264> what the hell? You just left me without a word?
560640563402244098,90,Anyone want to play. I'm looking for friends or sumthin to play with and help me get a win
