ID,Channel,Content Length,Content
558755761233199105,recommendations,8,Digimon?
558783891624689665,anime,26,Amano did the novel covers
558784549715443724,anime,53,Did someone inherit the novels after the author died?
558784779819024384,anime,43,Oh she must have had someone take over then
558785081200869416,anime,33,Right around when the anime aired
558785917700145162,anime,46,No idea I think the majority aren't translated
558786724537565196,anime,41,80s was a good time to take risks I guess
559034432368017423,games,21,Sega took over as CEO
559034643559612416,games,49,Well Pq2 is on 3ds <:yuishrug:529569462207250433>
