ID,Content Length,Content
558758020633460757,105,Is anyone weanling to help me improve in fortnite | I keep doing stupid mistakes and cant aim straight :c
558787735645585409,151,is anyone whilling to help me improve in fortnite_ I aint new i just do simple mistakes and wanna be that people with alot of kills dm if u can help me
558788267659493386,17,I am good for now
558996122157318150,96,Can anyone help me improve in fortnite_ I am not new i just struggle to aim and decision  making
559062832109322261,49,Can anyone help me get better at SMG aiming dm me
