ID,Server,Channel,Content Length,Content
560632020846379037,FlareTV - PewDiePie vs T-Series,general,4,GUYS
560632067474587670,FlareTV - PewDiePie vs T-Series,general,36,I HAVE GAINED THE POWERS OF THE GODS
560632104199651359,FlareTV - PewDiePie vs T-Series,general,25,I AM USING THE LIGHT MODE
560632149959507969,FlareTV - PewDiePie vs T-Series,general,42,AND I JUST INSTALLED A HIGH BRIGHTNESS APP
560632197296554005,FlareTV - PewDiePie vs T-Series,general,38,I JUST INSTALLED A HIGH BRIGHTNESS APP
