ID,Content Length,Content
560948651170463754,6,Cheers
560948688009035777,26,I somewhat agree with that
560949229397344286,129,What does this mean?NLThe government should own all the jobs?NLThe private businesses' should own themselves?NLOr something else?
560949567126896660,33,Right I get what you mean I think
560949846756818986,31,Is this the war in Afghanistan?
560950036859453471,78,We declared war on them because of 9/11 that's the basic summary of what I knw
560950084494163978,4,Wait
560950247451525120,63,I'm honestly neutral on the Afghanistan thing_ I know to little
