ID,Content Length,Content
559052103067107355,30,<@!514605993330606083> I agree
559052580668309514,25,Minecraft is a video game
559052735702630431,20,I only play fortnite
559052771219996675,24,oh crep I went off topic
559052907241144331,39,I thought minecraft was a starcraft mod
559053121926463498,70,<@!410269529344704513> why would you show this to me you psychopath :(
559053234799640576,11,squid milk?
559053462667657216,85,all the minecraft updates in the early dates would have "- Removed herobrine" in them
559053847235002378,34,I refuse bedrock with all my being
