ID,Server,Channel,Content Length,Content
559060473048203264,/r/Anime Discord!,anime,88,🤔 still need to watch the first one but after hearing this think i'll delete it from PTW
559097118850285568,/r/Anime Discord!,anime,47,Dropped inuyasha 5 eps in because of the femdom
559097278351278081,/r/Anime Discord!,anime,41,If it's not porn/hentai then i dislike it
559098499439001610,/r/Anime Discord!,anime,26,Bastard was an alright OVA
559098701662912522,/r/Anime Discord!,anime,38,Old school? Isn't the movie like 2012?
