ID,Server,Channel,Content Length,Content
559078452611907605,MINECRAFT,minecraft,45,Who here played hot wheels stunt track driver
559078512229744655,MINECRAFT,minecraft,10,Discord.gg
559078605842546689,MINECRAFT,minecraft,10,/minecraft
559078704156770305,MINECRAFT,minecraft,26,I like the update for 1.14
559078817621344256,MINECRAFT,minecraft,29,I made a city on top of water
559078853532975144,MINECRAFT,minecraft,17,No land for miles
559078923607080971,MINECRAFT,minecraft,25,Moonlight uh spotlight uh
