ID,Server,Channel,Content Length,Content
558849745087365120,/r/ProgrammerHumor,programming,35,i thought that was haskell at first
558849768676392980,/r/ProgrammerHumor,programming,30,rust is an intersting language
558849807813312533,/r/ProgrammerHumor,programming,17,haskell + c + c++
558850686859608097,/r/ProgrammerHumor,off-topic,43,I'm crushing my march madness bracket group
558850715766882315,/r/ProgrammerHumor,off-topic,26,$160 winner take all prize
558850802677186560,/r/ProgrammerHumor,off-topic,52,I actually have a 98% correct call average right now
559063418942783508,/r/ProgrammerHumor,off-topic,35,<@467576889926483969> cursed image.
560647999190204426,/r/ProgrammerHumor,general-discussions,33,I’m a software engineer on tinder
560648446004953101,/r/ProgrammerHumor,general-discussions,18,The ladies love it
