ID,Server,Channel,Content Length,Content
560624132799070218,Official Fortnite,lfg-savetheworld-pve,18,I’ll farm perk ups
560634900185874436,Official Fortnite,lfg-savetheworld-pve,86,Looking for one more for perk up mission. Already started with 3. DM me your Epic name
560640671460098049,Official Fortnite,stw-questions,52,Anything you can do when the treasure map is bugged?
560646227419463682,Official Fortnite,stw-questions,54,Can you use flux on survivors? Or just guns and hero’s
560646304905297931,Official Fortnite,stw-questions,50,I have like 600 legendary. Never touched the stuff
560649205329166337,Official Fortnite,stw-questions,19,I have most of them
