ID,Content Length,Content
559005598302339082,47,Whoever made these new textures should be fired
559005666786672671,22,They’re actually awful
559005818612219934,76,Minecraft was a classic but now it looks like all the other Minecraft clones
559005880407031828,28,Like look at the iron ingots
559005907309297674,14,This is not ok
559006046748803092,89,The textures have been the same for a decade but now all of the sudden they’re really bad
559006453441232925,30,It just ruins the classic feel
559006509518946316,51,It looks like survival craft or one of those clones
