ID,Server,Channel,Content Length,Content
558823766478684171,Official Fortnite,fortnite-general,22,I’m decent at fortnite
558823868031303680,Official Fortnite,fortnite-general,28,Is anyone good at there 90’s
558824141701120022,Official Fortnite,fortnite-general,51,I got that challenge finished <@501936550930546688>
558824243283099648,Official Fortnite,fortnite-general,24,Ok <@524034751380848642>
559034347102011438,Official Fortnite,lfg-battleroyale-pc,90,Anyone interested in Blackheart tournament DM me fast to be prepared EU_ got to be tryhard
559034936246403104,Official Fortnite,lfg-battleroyale-pc,29,EU Blackheart Cup add me fast
559040011379539988,Official Fortnite,lfg-battleroyale-pc,78,Please anyone you can play Blackheart Cup 3+KD to play money EU please send DM
