ID,Server,Channel,Content Length,Content
558427546912555009,SAO: Memory Defrag,global-md,95,Check ludwig's vid for more details_ he ~~stole my footage~~ has video footage of all scenarios
558427616324091905,SAO: Memory Defrag,global-md,27,Fake switch also drops hits
558427647848480810,SAO: Memory Defrag,global-md,25,Yes <@525068282546356227>
558427845811241010,SAO: Memory Defrag,global-md,7,jrAlice
558427985473044489,SAO: Memory Defrag,global-md,15,You want a crit
558427991122641006,SAO: Memory Defrag,global-md,3,Kek
558428016288464897,SAO: Memory Defrag,global-md,23,Worst buffs in the game
558428119288119316,SAO: Memory Defrag,global-md,21,Crit rateup worthless
558428149390508064,SAO: Memory Defrag,global-md,34,Crit dmg up meh compared to dmg up
558428187911258112,SAO: Memory Defrag,global-md,21,Fanatio uses a rapier
558428207590801439,SAO: Memory Defrag,global-md,23,And it has skill dmg up
558428238913732628,SAO: Memory Defrag,global-md,15,Not crit dmg up
558428307343802380,SAO: Memory Defrag,global-md,30,That's just rapiers in general
558428787772227599,SAO: Memory Defrag,global-md,3,Kek
558428820546519060,SAO: Memory Defrag,global-md,37,I mean it is nice for less crit grind
558428861571006505,SAO: Memory Defrag,global-md,43,But in theory you can just grind infinitely
558428872916336661,SAO: Memory Defrag,global-md,25,<:mmV:295974268913582080>
558428997520850955,SAO: Memory Defrag,global-md,17,Just ask here lul
558429016118525962,SAO: Memory Defrag,global-md,27,Or on <#511940147852476421>
558429054605328394,SAO: Memory Defrag,global-md,43,I see ludwig <:zoomeyes:488526058048716831>
558429112641912833,SAO: Memory Defrag,global-md,3,Kek
558429137845354499,SAO: Memory Defrag,global-md,27,Good luck getting 5 parries
558429360252518400,SAO: Memory Defrag,global-md,96,Well I need to grind 100% crit for ranking this weekend_ give me a good predicition chirp-senpai
558429517333528576,SAO: Memory Defrag,global-md,21,Hello what is a sigma
558429544361623555,SAO: Memory Defrag,global-md,22,Is that a new wep type
558429557158576153,SAO: Memory Defrag,global-md,26,<:Kapp:557215140081041419>
558429767465173042,SAO: Memory Defrag,global-md,36,PogNLI think I heard those terms once
558429793222393856,SAO: Memory Defrag,global-md,26,Too hard for my smol brain
558429823744212993,SAO: Memory Defrag,global-md,21,I'll just spam my run
558430060458016773,SAO: Memory Defrag,global-md,34,Is it possible to learn this power
558430200887508993,SAO: Memory Defrag,global-md,11,More than 0
558430255044493362,SAO: Memory Defrag,global-md,14,Less than 9999
558430275693182976,SAO: Memory Defrag,global-md,26,<:Kapp:557215140081041419>
558430324904820765,SAO: Memory Defrag,global-md,34,It depends on your letter rank too
558430747711635466,SAO: Memory Defrag,global-md,39,Is that one the Fanatio/Bercouli quest?
558430821803884564,SAO: Memory Defrag,global-md,43,Then it's 800 without boost 1600 with boost
558430849691811840,SAO: Memory Defrag,global-md,3,Oof
558430904922669066,SAO: Memory Defrag,global-md,76,Time spent learning stats could be spent spamming ranking runs for rng crits
558430919644676147,SAO: Memory Defrag,global-md,29,<:wesmart:510260787563200551>
558431129422528532,SAO: Memory Defrag,global-md,6,Ye tru
558431147516887050,SAO: Memory Defrag,global-md,22,No rng is truly random
558431238994657300,SAO: Memory Defrag,global-md,62,Gibe guaranteed crit units pls scamco so I don't need to grind
558431378190893057,SAO: Memory Defrag,new-player-help,66,How does one link an acc to gmail <:AkariThink:419270590860623893>
558431423158157312,SAO: Memory Defrag,new-player-help,32,You can only link it to fb afaik
558431566972321792,SAO: Memory Defrag,global-md,21,Use nsx on crit units
558431577231720457,SAO: Memory Defrag,global-md,2,Ez
558431726636892177,SAO: Memory Defrag,global-md,79,And so did the bossNLInstantly in factNL100% legit btwNL<:Kapp:557215140081041419>
558431909911461897,SAO: Memory Defrag,new-player-help,48,Does saomd have google play missions? First news
558432047509536768,SAO: Memory Defrag,new-player-help,91,I play on android and all google takes part in is stealing my money and converting it to md
558432107995594804,SAO: Memory Defrag,global-md,9,Strelizia
558432119278403614,SAO: Memory Defrag,global-md,28,<a:02Nod:491261489299324940>
558432247766712331,SAO: Memory Defrag,global-md,45,Strelizia is Darling in the FranXX main mecha
558432313051185162,SAO: Memory Defrag,global-md,28,<a:02Nod:491261489299324940>
558432585584214028,SAO: Memory Defrag,global-md,55,https://darling-in-the-franxx.fandom.com/wiki/Strelizia
558432623454846996,SAO: Memory Defrag,global-md,28,<a:02Nod:491261489299324940>
558432667410890753,SAO: Memory Defrag,global-md,26,Just to prove icyboi wrong
558432767726190592,SAO: Memory Defrag,global-md,19,Saomd x ditf collab
558432772734189568,SAO: Memory Defrag,global-md,4,When
558432788089536532,SAO: Memory Defrag,global-md,32,<a:POGGERING:443009728746881026>
558432854598746112,SAO: Memory Defrag,global-md,3,Rip
558432936550989844,SAO: Memory Defrag,global-md,21,Darling in the FranXX
558432987499331585,SAO: Memory Defrag,global-md,31,<a:02bounce:515428043112841217>
558433188116955156,SAO: Memory Defrag,global-md,86,She just looks at the camera and says 'it was aliens all along btw_ god bless trigger'
558433211370176568,SAO: Memory Defrag,global-md,8,Best ss3
558433378278572043,SAO: Memory Defrag,new-player-help,78,I believe there is a form you can fill and send to scamco to get your acc back
558433425241931816,SAO: Memory Defrag,new-player-help,51,Go to the saomd support page and it should be there
558771722472390667,SAO: Memory Defrag,global-md,21,Sort by attack big ew
558992556281692162,SAO: Memory Defrag,new-player-help,40,Those missiosn are for a different quest
558992634493009960,SAO: Memory Defrag,new-player-help,66,"Friendly Match in Fairyland" is the quest that came out yesterday
558992768119078942,SAO: Memory Defrag,new-player-help,76,Also the timing for Eldrie/Eugeo is on the notice_ they rotate every 3 hours
558993055319982080,SAO: Memory Defrag,new-player-help,47,To be fair even those are the same for everyone
558993092359880704,SAO: Memory Defrag,new-player-help,59,You just get them earlier or later depending on your logins
558996184492933129,SAO: Memory Defrag,new-player-help,36,At the end of November_ bath ranking
559001591189995552,SAO: Memory Defrag,new-player-help,36,don't worry about R5 armors early on
559001621246246913,SAO: Memory Defrag,new-player-help,55,just slowly farm MFs whenever possible until you get 50
559001703807189003,SAO: Memory Defrag,new-player-help,75,tier lists are worthless in this game so just ignore <@!262780141485293569>
559001713793826827,SAO: Memory Defrag,new-player-help,25,<:mmV:295974268913582080>
559001829216616449,SAO: Memory Defrag,new-player-help,22,swords are very common
559002005516058639,SAO: Memory Defrag,new-player-help,39,well ye at this point you might as well
559002027456462848,SAO: Memory Defrag,new-player-help,17,but in the future
559002232570511370,SAO: Memory Defrag,new-player-help,27,those weapons are very good
559002262274310144,SAO: Memory Defrag,new-player-help,44,Kirito's sword is the best dark sword so far
559002422643785758,SAO: Memory Defrag,new-player-help,45,best armor for swordcraft yuuki is yuuki's R5
559002510229110794,SAO: Memory Defrag,new-player-help,33,it's all there on the site I sent
559002613153005589,SAO: Memory Defrag,new-player-help,0,
559002673245061133,SAO: Memory Defrag,new-player-help,36,yeah the ranking armors are all good
559002699685691392,SAO: Memory Defrag,new-player-help,14,3% dmg on crit
559002740903247882,SAO: Memory Defrag,new-player-help,84,though depending on your run the older 3% damage on weakpoint armors might be better
559002833287118881,SAO: Memory Defrag,new-player-help,121,<@305454993157128194> don't assume anything_ we had the first ever wind ranking since 6* came out in September last month
559002888093827083,SAO: Memory Defrag,new-player-help,62,we've had repeat element rankings before wind ever came around
559002923749605396,SAO: Memory Defrag,new-player-help,12,in September
559002928048766977,SAO: Memory Defrag,new-player-help,3,lul
559002959791521802,SAO: Memory Defrag,new-player-help,23,I said it in my message
559003086539063308,SAO: Memory Defrag,new-player-help,46,also the previous wind ranking was last summer
559003091803045891,SAO: Memory Defrag,new-player-help,4,lulz
559003139441819649,SAO: Memory Defrag,new-player-help,19,that was 5* era tho
559003216952426498,SAO: Memory Defrag,new-player-help,94,<@340138975924715520> all R5 armors have a base ATK value and then 3/2% buff for certain units
559003289270878208,SAO: Memory Defrag,new-player-help,106,Argo's armor is usually recommended as first armor because it has the highest base attack and it is unisex
559003346317475850,SAO: Memory Defrag,new-player-help,56,the rest of the armors are locked to their units' gender
559003436386091040,SAO: Memory Defrag,new-player-help,80,<@305454993157128194> we might get a rainbow banner with a water unit (or units)
559003564387598366,SAO: Memory Defrag,new-player-help,3,yes
559003593047408640,SAO: Memory Defrag,new-player-help,45,that's always been the case since 6* came out
559003609971556372,SAO: Memory Defrag,new-player-help,29,only exception was SKS banner
559003649045430272,SAO: Memory Defrag,new-player-help,9,Sankishin
559003670679912449,SAO: Memory Defrag,new-player-help,36,the goddess banner we got in January
559003758743257088,SAO: Memory Defrag,new-player-help,62,Also keep in mind only 200 HC of another element can be traded
559003818080206859,SAO: Memory Defrag,new-player-help,74,no_ the most recent rainbow banner is the currently-ongoing Rain/Sinon one
559003833263456276,SAO: Memory Defrag,new-player-help,32,and we can trade HCs on that one
559003882123165697,SAO: Memory Defrag,new-player-help,99,I think they didn't let us trade on SKS since 2/3 elements were repeats from January's first banner
559003948489506828,SAO: Memory Defrag,new-player-help,53,the % attack bonus is not as important as base attack
559004014071644165,SAO: Memory Defrag,new-player-help,24,just do some quick maffs
559004062906056724,SAO: Memory Defrag,new-player-help,26,3% of 8k attack is 240 atk
559004105323053067,SAO: Memory Defrag,new-player-help,36,base attack on most armors is 400ish
559004222855708692,SAO: Memory Defrag,new-player-help,48,also base attack gets attack buffs applied to it
559004269907279873,SAO: Memory Defrag,new-player-help,65,whereas the atk boost is only additively added to the other buffs
559004333056983080,SAO: Memory Defrag,new-player-help,30,basically base stats > % buffs
559004406880927765,SAO: Memory Defrag,new-player-help,71,if you can get a unit to match like Yuuki with Yuuki armor_ then better
559004421632163841,SAO: Memory Defrag,new-player-help,28,but it's not super important
559004489114189849,SAO: Memory Defrag,new-player-help,30,yeah that table is pinned here
559004511373361153,SAO: Memory Defrag,new-player-help,34,in case you want to check it later
559004555656953856,SAO: Memory Defrag,new-player-help,55,~~though I kind of disagree with some of the rankings~~
559004611948707850,SAO: Memory Defrag,new-player-help,6,Is it?
559004620316475394,SAO: Memory Defrag,new-player-help,15,did you update?
559004689618829313,SAO: Memory Defrag,new-player-help,24,oh you added Eugeo armor
559004694735880212,SAO: Memory Defrag,new-player-help,11,I see I see
559004721986273281,SAO: Memory Defrag,new-player-help,42,maybe we should pin the google doc instead
559004751522562058,SAO: Memory Defrag,new-player-help,19,oh but it is pinned
559004801510146048,SAO: Memory Defrag,new-player-help,36,Insane Armor is locked to male units
559004814374338563,SAO: Memory Defrag,new-player-help,20,Argo armor is unisex
559004823299555348,SAO: Memory Defrag,new-player-help,21,this is a huge factor
559004866823979008,SAO: Memory Defrag,new-player-help,3,kek
