ID,Channel,Content Length,Content
558778008685510707,ln-spoilers,36,Admin can go jump off the 22nd floor
559109578047094804,ln-spoilers,57,https://www.youtube.com/watch?v=eL28nE2gxVY 1:00 is me rn
559110462936186881,alicization-anime-spoilers,63,whatever they play next episode is gonna become my trigger song
559110895494496266,alicization-anime-spoilers,30,despacito already makes me sad
559111382948380672,ln-spoilers,97,ill probs read the second half of ALI but not gonna read UR until someone confirms eugeo is in it
