ID,Content Length,Content
558870572889669634,70,Anyone wanna do gauntlet duos DM me (I'm qualified for Blackheart cup)
558870796265586733,19,blackheart is solos
559045287860240394,70,Anyone wanna run up some gauntlet duos (i'm waiting for blackheart cup
559045711623225344,74,Anyone wanna run up some gauntlet duos (i'm waiting for blackheart cup) DM
559046059171643392,74,Anyone wanna run up some gauntlet duos (i'm waiting for blackheart cup) DM
559078623055708185,64,Anyone want to play gauntlet until blackheart cup launches DM me
