ID,Server,Channel,Content Length,Content
559028687010529295,/r/Anime Discord!,anime,33,I dont remember half of the names
559029117807493169,/r/Anime Discord!,anime,72,And if what i remember is a dynamic_ then it appears almost non existant
559032727370727446,/r/Anime Discord!,anime,44,Tbh i just want an excuse to watch eva again
559033425793777695,/r/Anime Discord!,manga,28,Pseudo harem is a good manga
559034497308426241,/r/Anime Discord!,anime,40,Yeah_ and then they hit ya with emotions
559034674454724618,/r/Anime Discord!,anime,5,It is
559034683367751770,/r/Anime Discord!,anime,3,Ngl
559034746470924318,/r/Anime Discord!,anime,28,But it also has other things
559034814297276465,/r/Anime Discord!,anime,29,Like the messed up characters
