ID,Server,Channel,Content Length,Content
558762677896478722,Official Fortnite,lfg-battleroyale-pc,49,want to play_ im new to pc and want to get better
558778401612103681,Official Fortnite,lfg-battleroyale-pc,35,im new to pc and want to get better
558779635790250024,Official Fortnite,lfg-battleroyale-pc,40,new to pc and want to get better_ im NAE
558812504151687170,Official Fortnite,lfg-creative,36,im new and want to get better im NAE
558812789997830154,Official Fortnite,lfg-creative,3,yea
559101837056278530,Official Fortnite,lfg-creative,56,im new to pc and want to get better_ can someone help me
