ID,Channel,Content Length,Content
560976062306320386,pewdiepie-vs-tseries,19,Karen took the kids
560976195349512232,general,19,Karen took the kids
560976537331957781,general,12,Jesus_ what?
560976789006974976,general,112,Well why did you mention that you have a gf in a server full of people who you don't know  <@383681993508126722>
560976956582002698,general,6,K fine
560977232508485632,pewdiepie-vs-tseries,17,The war has begun
560977556577189898,pewdiepie-vs-tseries,54,Normally PewDiePie says he doesn't care about t series
