ID,Content Length,Content
560633409811120128,56,Now_ while he's ahead_ I beg you to please be reasonable
560633430438707219,12,T-Series won
560633448562163712,15,Fair and square
560633482187898900,30,Without 91M alternate accounts
560633524416282637,9,So please
560633597607018496,71,Give it a rest_ get a life_ and let them hold it for 1 day. JUST 1 day.
560633677743390730,106,Yeah_ a bot purge revealed that over 10K of pewdiepie's subs were bots back in Feb_ and T-Series was ahead
560633796165238785,49,And you forget_ T-Series is an indian MUSIC LABEL
560633891833249825,59,If I'm not mistaken this is a PewDiePie vs. T-SERIES server
560633940961001472,36,Not a PewDiePie vs. PewDiePie server
560634053041192970,61,....I'mma pretend you've been reading my messages up till now
560634178190704641,59,But seriously though_ please give T-Series a break for ONCE
560634262752198656,64,So BTS and Jackie Chan aren't the only thing that represent Asia
560634332356673556,42,Yeah_ I saw_ but the sub count is dropping
560634490154647552,26,Boi_ it was 30K a week ago
560634803125485588,7,Yeah no
560634918590218242,19,About to drop to 9K
560635131099086848,38,Boi you do NOT know Pewdiepie's fandom
560635424935247902,24,It's 6:24 here in the US
560635506098962437,52,The racist and memelord 9 year olds still can fix it
560635615746457602,56,Plus there's the rich expensive 9 year olds in Singapore
560635675662352405,41,And then the drunk 9 year olds in Finland
560636058723811328,38,Lol_ we all know that was proven false
560637312241893386,39,Nah_ they are going to get passed sadly
560637912606179338,31,The gap count is still dropping
560637933284098048,25,But now at a snail's pace
560638035423789102,43,You're right_ the Indian kids are waking up
560638361736577044,7,YAAAAAA
560638488542969906,26,I've never seen it so slow
