ID,Server,Channel,Content Length,Content
558434723744186389,MINECRAFT,multiplayer,79,Can someone build a city with me? I'll be on for about an hour. Bedrock edition
558793304221679618,MINECRAFT,multiplayer,41,Would someone like to join a realm? Dm me
558794011046051900,MINECRAFT,multiplayer,54,Does anyone wanna join a bedrock survival realm? DM me
558794525896867841,MINECRAFT,multiplayer,48,Does anyone wanna join a bedrock survival realm?
558795261288251402,MINECRAFT,multiplayer,54,Does anyone wanna join a bedrock survival realm? DM me
559094207776555030,MINECRAFT,multiplayer,60,Can someone please help me build a city  in bedrock edition?
