ID,Channel,Content Length,Content
558808471886364695,multiplayer,49,If you want to play on my realm heres the website
558808904847589385,minecraft,84,if you want to join my realm heres the website https://vidoepanda.wixsite.com/mysite
558808953736396812,minecraft,37,https://vidoepanda.wixsite.com/mysite
558815253295661056,multiplayer,19,i have a realm open
558817555217776650,multiplayer,110,hey_I have a realm on minecraft bedrock edition. Its looking for mature kids/adults. DM me if you want to join
558818063600975872,multiplayer,15,i have java too
