ID,Channel,Content Length,Content
559004730043400196,battle-royale,65,how come that i was so good this morning and now im a fucking bot
559021174391308298,battle-royale,118,lost to a bot camping on the side of the map with a baller_ he misplaced a floor on top of me right when i shot my rpg
559096928047202342,battle-royale,45,gotta love it when u die to bots with 2 kills
559097019168194620,battle-royale,84,especially bots with 2 kills that are camping all their matches and have double RPGs
559097116149022730,battle-royale,62,like this one has 16 wins in s8 with 8% winrate but kd of 1.17
