ID,Content Length,Content
n all_ all battle pass skins stay exclusive_ doesnt matter how much youre willing to pay.
560608192816742430,50,I grinded for that skin bro <@!524257728944668686>
560608111845572608,191,in epics eyes_ yes. yours is better and youre right. i did only pay nine. But its the recognition that i played. I got it on the extra day that they gave us for season 2. Since I got it late.
560608762428129292,59,what yall think of “Dry Hands” by C418. somg on minecraft^^
560608886520807492,35,<:kyleconcerned:503312835674243083>
560609039298592769,72,go to clan recruitment sucka <@448304404345389056> <#426480013899202580>
