ID,Channel,Content Length,Content
558434576326983690,general,25,Spotlight uh moonlight uh
559109307837317122,general,16,Shut the fuck up
559109726374330378,general,24,Who do you think you are
559110182794297362,general,147,Disrespect me again and i will determine your bodies resonant frequency and play a jaunty horn solo that will turn your miserable organs inside out
559110815953977355,general,6,On Gek
559111149942079500,general,22,I will shit your pants
559111416280383529,general,25,Spotlight uh moonlight uh
559111434298982410,general,12,Circumcision
