ID,Server,Channel,Content Length,Content
558761632684048404,masterani.me,18plus,31,how does a girl flick her beans
558761656776392725,masterani.me,18plus,24,time to flick your beans
558761870656274473,masterani.me,18plus,44,sksksksk my cousin kept saying FLick DA beAN
558761914117914624,masterani.me,18plus,24,when we were coming home
558761933814104074,masterani.me,18plus,4,lmao
558761983441240115,masterani.me,18plus,40,i also was correct then bean is the clit
558761992425570314,masterani.me,18plus,6,thanks
